perfume_name,perfume_link
YSL Black Opium Eau De Parfum Intense For Women 90ML,https://www.perfume24x7.com//collections/women/products/ysl-black-opium-intense-90ml-edp-for-women
Calvin Klein CK Euphoria Intense Eau De Parfum For Women 100ml,https://www.perfume24x7.com//collections/women/products/calvin-klein-ck-euphoria-intense-eau-de-parfum-for-women-100ml
Titan Skinn Celeste Eau De Parfum For Women,https://www.perfume24x7.com//collections/women/products/titan-celeste-women
Titan Skinn Pristine Eau De Parfum for Women,https://www.perfume24x7.com//collections/women/products/titan-skinn-pristine-edp-for-women
Ajmal Amber Poivre EDP 100ml,https://www.perfume24x7.com//collections/women/products/ajmal-amber-poivre-edp-100ml
Tom Ford Metallique Eau De Parfum 100ML,https://www.perfume24x7.com//collections/women/products/tom-ford-metallique-eau-de-parfum-for-women-100ml
Clinique Happy Heart Parfum Spray For Women 100ML,https://www.perfume24x7.com//collections/women/products/clinique-happy-heart-parfum-spray-for-women-100ml
Mercedes Benz Pop Edition Eau De Parfum For Women 90ml,https://www.perfume24x7.com//collections/women/products/mercedes-benz-pop-edition-eau-de-parfum-for-women-90ml
Valentino Voce Viva Eau De Parfum For Women,https://www.perfume24x7.com//collections/women/products/valentino-voce-viva-eau-de-parfum-for-women
Viktor & Rolf Bonbon EDP For Women,https://www.perfume24x7.com//collections/women/products/viktor-rolf-bonbon-edp-for-women
Thierry Mugler Angel Nova Eau De Parfum For Women,https://www.perfume24x7.com//collections/women/products/thierry-mugler-angel-nova-eau-de-parfum-for-women
Valentino Voce Viva Intense Eau De Parfum For Women,https://www.perfume24x7.com//collections/women/products/valentino-voce-viva-intense-eau-de-parfum-for-women
Chloe L'eau Eau De Toilette For Women,https://www.perfume24x7.com//collections/women/products/chloe-leau-eau-de-toilette-for-women
Guess Bella Vita Rosa Eau De Toilette For Women 100ml,https://www.perfume24x7.com//collections/women/products/guess-bella-vita-rosa-eau-de-toilette-for-women-100ml
Creed Aventus Eau De Parfum For Her 75ML,https://www.perfume24x7.com//collections/women/products/creed-aventus-eau-de-parfum-100ml-1
Creed Love In White Eau De Parfum For Women 75ML,https://www.perfume24x7.com//collections/women/products/creed-love-in-white-eau-de-perfume-for-women-100ml
Creed Original Santal Eau De Parfum For Women 100ml,https://www.perfume24x7.com//collections/women/products/creed-original-santal-eau-de-parfum-100ml
Creed Royal Princess Oud For Women 75ML,https://www.perfume24x7.com//collections/women/products/creed-royal-princess-oud-for-women-75ml
Creed Exclusive Pure White Cologne 75ML,https://www.perfume24x7.com//collections/women/products/creed-pure-white-colonge-75ml
Creed Erolfa Eau De Parfum for Men 100ml,https://www.perfume24x7.com//collections/women/products/creed-erolfa-eau-de-perfum-for-men-100ml
Elizabeth Arden White Tea Wild Rose Eau De Toilette For Women 100ml,https://www.perfume24x7.com//collections/women/products/elizabeth-arden-white-wild-rose-tea-eau-de-toilette-for-women-100ml
Guess Seductive Red Eau De Toilette For Women,https://www.perfume24x7.com//collections/women/products/guess-seductive-red-eau-de-toilette-for-women
Giorgio Armani Si Intense Eau De Parfum For Women,https://www.perfume24x7.com//collections/women/products/giorgio-armani-si-intense-eau-de-parfum-for-women
Salvatore Ferragamo Incanto Dream Eau De Toilette For Women 100ml,https://www.perfume24x7.com//collections/women/products/salvador-ferragamo-incanto-dream-women-edt
Britney Spears Private Show Eau De Parfum for Women 100ml,https://www.perfume24x7.com//collections/women/products/britney-spears-private-show-edp-for-women-100ml
Tom Ford Black Orchid Eau De Parfum 100ml,https://www.perfume24x7.com//collections/women/products/tom-ford-black-orchid-edp
Victoria's Secret Velvet Petals Refreshing Gel Body Wash for Women 300ml,https://www.perfume24x7.com//collections/women/products/victorias-secret-velvet-petals-refreshing-gel-body-wash-for-women-300ml
Paco Rabanne Olympea Deodorant Natural Spray For Women 150ML,https://www.perfume24x7.com//collections/women/products/paco-rabanne-pure-xs-deodorant-for-women-150ml
Carolina Herrera Good Girl Fantastic Pink Eau De Parfum Women 80ml,https://www.perfume24x7.com//collections/women/products/carolina-herrera-good-girl-fantastic-pink-eau-de-parfum-women-80ml
Elie Saab Girl of Now Deodorant for Woman 100ml,https://www.perfume24x7.com//collections/women/products/elie-saab-girl-of-now-deodorant-for-woman-150ml
Lancome Miracle Eau De Parfum For Women 100ml,https://www.perfume24x7.com//collections/women/products/lancome-miracle-edp-for-women-100ml
UCB Sisterland Green Jasmine Eau De Toilette  For Women 80ml,https://www.perfume24x7.com//collections/women/products/ucb-sisterland-green-jasmine-edt-for-women-80ml
UCB Sisterland Red Rose Eau De Toilette For Women 80ml,https://www.perfume24x7.com//collections/women/products/ucb-sisterland-red-rose-edt-for-women-80ml
Calvin Klein CK DownTown Eau De Parfum For Women 90ml,https://www.perfume24x7.com//collections/women/products/calvin-klein-downtown-edp-for-women-90ml
HUGO BOSS Woman Eau De Toilette 125ML,https://www.perfume24x7.com//collections/women/products/hugo-boss-woman-eau-de-toilette-125ml
Antonio Banderas Queen of Seduction For Women Eau De Toilette 80 ML,https://www.perfume24x7.com//collections/women/products/antonio-banderas-queen-of-seduction-for-women-edt-80-ml
YSL Mon Paris Eau De Parfum For Women 90ml,https://www.perfume24x7.com//collections/women/products/ysl-mon-paris-90ml-edp-for-women
Calvin Klein CK Euphoria Intense Eau De Parfum For Women 100ml,https://www.perfume24x7.com//collections/women/products/calvin-klein-ck-euphoria-intense-eau-de-parfum-for-women-100ml
YSL Black Opium Eau De Parfum Intense For Women 90ML,https://www.perfume24x7.com//collections/women/products/ysl-black-opium-intense-90ml-edp-for-women
Skinn Noura Floret Eau De Parfum For Her 100ML,https://www.perfume24x7.com//collections/women/products/skinn-noura-floret-eau-de-parfum-for-her-100ml
Titan Skinn Amalfi Blue Him/Her Gift Set 90ml,https://www.perfume24x7.com//collections/women/products/titan-skinn-amalfi-blue-him-her-gift-set-90ml
Nina Ricci Premier Jour Eau De Parfum For Women 100ml,https://www.perfume24x7.com//collections/women/products/nina-ricci-premier-jour-for-women
Elie Saab 4pc Miniatures Collection Eau De Parfum For Women,https://www.perfume24x7.com//collections/women/products/elie-saab-4pc-miniatures-collection-eau-de-parfum-for-women
Versace Versus Eau De Toilette For Women 100ml,https://www.perfume24x7.com//collections/women/products/versace-versus-edt-for-women-100ml
Creed Erolfa Eau De Parfum for Men 100ml,https://www.perfume24x7.com//collections/women/products/creed-erolfa-eau-de-perfum-for-men-100ml
Creed Exclusive Pure White Cologne 75ML,https://www.perfume24x7.com//collections/women/products/creed-pure-white-colonge-75ml
Creed Royal Princess Oud For Women 75ML,https://www.perfume24x7.com//collections/women/products/creed-royal-princess-oud-for-women-75ml
Afnan 9AM Eau De Parfum For Women 100ML,https://www.perfume24x7.com//collections/women/products/afnan-9am-eau-de-parfum-for-men-100ml
Giorgio Armani Si Intense Eau De Parfum For Women,https://www.perfume24x7.com//collections/women/products/giorgio-armani-si-intense-eau-de-parfum-for-women
Davidoff Cool Water Reborn Eau De Parfum For Women,https://www.perfume24x7.com//collections/women/products/davidoff-cool-water-reborn-eau-de-parfum-for-women-100ml
Carolina Herrera Good Girl Glorious Gold Eau De Parfum Women 80ml,https://www.perfume24x7.com//collections/women/products/carolina-herrera-good-girl-glorious-gold-eau-de-parfum-women-80ml
Elizabeth Arden White Tea Ginger Lily Eau De Toilette For Women 100ml,https://www.perfume24x7.com//collections/women/products/elizabeth-arden-white-tea-ginger-lily-eau-de-toilette-for-women-100ml
Coco Chanel Eau De Parfum For Women 100ml,https://www.perfume24x7.com//collections/women/products/coco-chanel-eau-de-perfume-for-women-100ml
Lattafa Qaa'ed Eau De Parfum For Men and Women 100ML,https://www.perfume24x7.com//collections/women/products/lattafa-tribute-najdia-eau-de-parfum-100ml
Gucci Flora Eau De Toilette for Women 75ml,https://www.perfume24x7.com//collections/women/products/gucci-flora-edt-for-women-75ml
Mancera Paris Roses Vanilla Eau De Parfum 120ml,https://www.perfume24x7.com//collections/women/products/mancera-paris-roses-vanilla-edp-120ml
Elizabeth Arden Always Red Femme Eau De Parfum For Women 100ml,https://www.perfume24x7.com//collections/women/products/elizabeth-arden-always-red-femme-edp-for-women-100ml
Coco Mademoiselle Chanel Eau De Parfum For Women 100ml,https://www.perfume24x7.com//collections/women/products/coco-mademoiselle-chanel-eau-de-parfum-for-women-100ml
Victoria's Secret Bombshell EDP For Women,https://www.perfume24x7.com//collections/women/products/victorias-secret-bombshell-edp-1
Chanel Coco Noir Eau De Parfum For Women 100ml,https://www.perfume24x7.com//collections/women/products/chanel-coco-noir-eau-de-parfum-for-women-100ml
Gucci Guilty Black Eau De Toilette For Women 75ml,https://www.perfume24x7.com//collections/women/products/gucci-guilty-black-edt-for-women-75ml
Prada L'Femme Eau De Parfum For Women 100ml,https://www.perfume24x7.com//collections/women/products/prada-lfemme-edp-for-women-100-ml
Estee Lauder Modern Muse Eau De Parfum For Women 100ml,https://www.perfume24x7.com//collections/women/products/estee-lauder-modern-muse-edp-for-women-100ml
Chanel No.5 Eau De Perfume For Women 100ML,https://www.perfume24x7.com//collections/women/products/chanel-no-5-eau-de-parfum-for-women-100ml
Chanel Coco Mademoiselle Eau De Toilette For Women 100ml,https://www.perfume24x7.com//collections/women/products/chanel-coco-mademoiselle-eau-de-toilette-for-women-100ml
Carolina Herrera 212 VIP Women Eau De Parfum 80ml,https://www.perfume24x7.com//collections/women/products/carolina-herrera-212-vip-women-edp-80ml
Burberry Body Eau De Parfum For Women 85ml,https://www.perfume24x7.com//collections/women/products/burberry-body-edp-for-women-85ml
Burberry My Burberry Eau De Parfum For Women 90 Ml,https://www.perfume24x7.com//collections/women/products/burberry-my-burberry-edp-for-women-90-ml
Chanel No.5 L'Eau Eau De Toilette For Women 100ml,https://www.perfume24x7.com//collections/women/products/chanel-no-5-edp-for-women
Gucci Bloom Gocce Di Fiori EDT For Women 100ML,https://www.perfume24x7.com//collections/women/products/gucci-bloom-gocce-di-fiori-edt-for-women-100ml
Carolina Herrera 212 Women NYC Deodorant 150ml,https://www.perfume24x7.com//collections/women/products/carolina-herrera-212-women-nyc-deodorant-150ml
Miss Dior Blooming Bouquet Eau De Toilette For Women,https://www.perfume24x7.com//collections/women/products/miss-dior-blooming-bouquet-edt-for-women
Issey Miyake Pleats Please L'eau 100ml Eau De Toilette For Women,https://www.perfume24x7.com//collections/women/products/issey-miyake-pleats-please-for-women
Calvin Klein CK Escape Eau De Parfum For Women 100ml,https://www.perfume24x7.com//collections/women/products/calvin-klein-escape-edp-for-women-100ml-1
Lancome Poeme L' Eau De Parfum For Women 100ml,https://www.perfume24x7.com//collections/women/products/lancome-poeme-leau-de-parfum-for-women-100ml
Paco Rabanne Pure XS Deodorant for Woman 150ml,https://www.perfume24x7.com//collections/women/products/paco-rabonee-pure-xs-deodorant-for-woman-150ml
Chloe L'eau Eau De Toilette For Women,https://www.perfume24x7.com//collections/women/products/chloe-leau-eau-de-toilette-for-women
Creed Original Santal Eau De Parfum For Women 100ml,https://www.perfume24x7.com//collections/women/products/creed-original-santal-eau-de-parfum-100ml
Creed Love In White Eau De Parfum For Women 75ML,https://www.perfume24x7.com//collections/women/products/creed-love-in-white-eau-de-perfume-for-women-100ml
Valentino Voce Viva Intense Eau De Parfum For Women,https://www.perfume24x7.com//collections/women/products/valentino-voce-viva-intense-eau-de-parfum-for-women
Guess Seductive Red Eau De Toilette For Women,https://www.perfume24x7.com//collections/women/products/guess-seductive-red-eau-de-toilette-for-women
Guess Bella Vita Rosa Eau De Toilette For Women 100ml,https://www.perfume24x7.com//collections/women/products/guess-bella-vita-rosa-eau-de-toilette-for-women-100ml
Creed Aventus Eau De Parfum For Her 75ML,https://www.perfume24x7.com//collections/women/products/creed-aventus-eau-de-parfum-100ml-1
Elizabeth Arden White Tea Wild Rose Eau De Toilette For Women 100ml,https://www.perfume24x7.com//collections/women/products/elizabeth-arden-white-wild-rose-tea-eau-de-toilette-for-women-100ml
Thierry Mugler Angel Nova Eau De Parfum For Women,https://www.perfume24x7.com//collections/women/products/thierry-mugler-angel-nova-eau-de-parfum-for-women
Mercedes Benz Pop Edition Eau De Parfum For Women 90ml,https://www.perfume24x7.com//collections/women/products/mercedes-benz-pop-edition-eau-de-parfum-for-women-90ml
Clinique Happy Heart Parfum Spray For Women 100ML,https://www.perfume24x7.com//collections/women/products/clinique-happy-heart-parfum-spray-for-women-100ml
Tom Ford Metallique Eau De Parfum 100ML,https://www.perfume24x7.com//collections/women/products/tom-ford-metallique-eau-de-parfum-for-women-100ml
Titan Skinn Pristine Eau De Parfum for Women,https://www.perfume24x7.com//collections/women/products/titan-skinn-pristine-edp-for-women
Viktor & Rolf Bonbon EDP For Women,https://www.perfume24x7.com//collections/women/products/viktor-rolf-bonbon-edp-for-women
Ajmal Amber Poivre EDP 100ml,https://www.perfume24x7.com//collections/women/products/ajmal-amber-poivre-edp-100ml
Valentino Voce Viva Eau De Parfum For Women,https://www.perfume24x7.com//collections/women/products/valentino-voce-viva-eau-de-parfum-for-women
Titan Skinn Celeste Eau De Parfum For Women,https://www.perfume24x7.com//collections/women/products/titan-celeste-women
Afnan 9AM Eau De Parfum For Women 100ML,https://www.perfume24x7.com//collections/women/products/afnan-9am-eau-de-parfum-for-men-100ml
Chanel No.5 Eau De Perfume For Women 100ML,https://www.perfume24x7.com//collections/women/products/chanel-no-5-eau-de-parfum-for-women-100ml
Coco Chanel Eau De Parfum For Women 100ml,https://www.perfume24x7.com//collections/women/products/coco-chanel-eau-de-perfume-for-women-100ml
Elizabeth Arden White Tea Ginger Lily Eau De Toilette For Women 100ml,https://www.perfume24x7.com//collections/women/products/elizabeth-arden-white-tea-ginger-lily-eau-de-toilette-for-women-100ml
Carolina Herrera Good Girl Glorious Gold Eau De Parfum Women 80ml,https://www.perfume24x7.com//collections/women/products/carolina-herrera-good-girl-glorious-gold-eau-de-parfum-women-80ml
Chanel Coco Mademoiselle Eau De Toilette For Women 100ml,https://www.perfume24x7.com//collections/women/products/chanel-coco-mademoiselle-eau-de-toilette-for-women-100ml
Davidoff Cool Water Reborn Eau De Parfum For Women,https://www.perfume24x7.com//collections/women/products/davidoff-cool-water-reborn-eau-de-parfum-for-women-100ml
Victoria's Secret Bombshell Intense Eau De Parfum RollerBall 7ml For Women,https://www.perfume24x7.com//collections/women/products/victorias-secret-bombshell-intense-edp-rollerball-7ml-for-women
Paco Rabanne Pure XS Deodorant for Woman 150ml,https://www.perfume24x7.com//collections/women/products/paco-rabonee-pure-xs-deodorant-for-woman-150ml
Lancome Poeme L' Eau De Parfum For Women 100ml,https://www.perfume24x7.com//collections/women/products/lancome-poeme-leau-de-parfum-for-women-100ml
Disney Princess Cinderella Eau De Toilette For Kids 100ML,https://www.perfume24x7.com//collections/women/products/disnep-princess-cinderella-eau-de-toilette-100ml
Disney Princess Ariel Eau De Toilette For Kids 100ML,https://www.perfume24x7.com//collections/women/products/disney-princess-ariel-eau-de-toilette-for-girls-100ml
Disney Minnie Mouse Eau De Toilette For Kids 100ML,https://www.perfume24x7.com//collections/women/products/disney-minnie-mouse-eau-de-toilette-100ml
Versace Vanitas Eau De Toilette For Women 100ml,https://www.perfume24x7.com//collections/women/products/versace-vanitas-eau-de-toilette-for-women-100ml
Bvlgari Omnia Crystalline (The Omnialandia Limited Edition) Eau De Toilette For Women 65ml,https://www.perfume24x7.com//collections/women/products/bvlgari-omnia-crystalline-the-omnialandia-limited-edition-eau-de-toilette-for-women-65ml
Elizabeth Arden Red Door Aura Eau De Toilette For Women 100ml,https://www.perfume24x7.com//collections/women/products/elizabeth-arden-red-door-aura-eau-de-parfum-for-women-100ml-1
Elizabeth Arden Red Door Shimmer Eau De Parfum For Women 100ML,https://www.perfume24x7.com//collections/women/products/elizabeth-arden-red-door-shimmer-eau-de-parfum-for-women-100ml
L'Extase Rose Absolue By Nina Ricci Eau De Parfum For Women 80ml,https://www.perfume24x7.com//collections/women/products/lextase-rose-absolue-by-nina-ricci-eau-de-parfum-for-women-80ml-1
Elizabeth Taylor Diamonds And Emeralds Eau De Toilette For Women 100ml,https://www.perfume24x7.com//collections/women/products/elizabeth-taylor-diamonds-and-emeralds-eau-de-toilette-for-women-100ml
Estee Lauder Beautiful 2pc Gift Set  For Women,https://www.perfume24x7.com//collections/women/products/estee-lauder-treasures-4pc-miniature-travel-collection-for-women
Salvatore Ferragamo Amo Flowerful Eau De Toilette For Women 100ml,https://www.perfume24x7.com//collections/women/products/salvatore-ferragamo-amo-flowerful-eau-de-toilette-for-women-100ml
Carolina Herrera 212 VIP Wins Eau De Parfum For Women 80ML,https://www.perfume24x7.com//collections/women/products/carolina-herrera-212-vip-wins-eau-de-parfum-for-women-80ml
Paco Rabanne Olympea Aqua Eau De Parfum For Women 80ml,https://www.perfume24x7.com//collections/women/products/paco-rabanne-olympea-aqua-eau-de-parfum-for-women-80ml
Paco Rabanne Olympea Legend Eau De Parfum For Women 80ml,https://www.perfume24x7.com//collections/women/products/paco-rabanne-olympea-legend-eau-de-parfum-for-women-80ml
Guess 1981 Eau de Toilette For Women 100ml,https://www.perfume24x7.com//collections/women/products/guess-1981-eau-de-toilette-for-women-100ml
Michael Kors Glam Jasmine Eau de Parfum 100ml,https://www.perfume24x7.com//collections/women/products/michael-kors-wonderlust-eau-de-parfum-100ml-1
Valentino Valentina Eau De Parfum For Women 80ML,https://www.perfume24x7.com//collections/women/products/valentino-valentina-eau-de-parfum-for-women-80ml
Viktor & Rolf Flower Bomb Dew EDP For Women 100ML,https://www.perfume24x7.com//collections/women/products/viktor-rolf-flower-bomb-dew-edp-for-women-100ml
Bvlgari Omnia Crystalline EDT 2pc Gift Set For Women,https://www.perfume24x7.com//collections/women/products/bvlgari-omnia-crystalline-edt-2pc-gift-set-for-women
Burberry My Burberry Eau De Toilette  For Women 90 Ml,https://www.perfume24x7.com//collections/women/products/burberry-my-burberry-edt-for-women-90-ml
Victorias Secret Tease Silk Shower Oil 250ml,https://www.perfume24x7.com//collections/women/products/victorias-secret-tease-silk-shower-oil-250ml
Victoria's Secret Tease Petal Scrub For Women 283gm,https://www.perfume24x7.com//collections/women/products/victorias-secret-tease-petal-scrub-for-women-283gm
Victoria's Secret Love Addict Cloud Wash Foaming Gel Cleanser for Women 130gm,https://www.perfume24x7.com//collections/women/products/victorias-secret-love-addict-cloud-wash-foaming-gel-cleanser-for-women-130gm
Versace Yellow Diamond Perfumed Deodorant for Women 50ml,https://www.perfume24x7.com//collections/women/products/versace-yellow-diamond-perfumed-deodorant-for-women-50ml
Tommy Hilfiger All Over Girl Body Deodorant Spray 200ml,https://www.perfume24x7.com//collections/women/products/tommy-hilfiger-all-over-girl-body-deodorant-spray-200ml
Victoria's Secret Bombshell Seduction Eau De Parfum 4pc Gift Set For Women,https://www.perfume24x7.com//collections/women/products/victorias-secret-bombshell-seduction-eau-de-parfum-4pc-gift-set-for-women
Victoria's Secret Tease Eau De Parfum For Women 100ml,https://www.perfume24x7.com//collections/women/products/victorias-secret-tease-eau-de-parfum-for-women-100ml
Calvin Klein CK Escape Eau De Parfum For Women 100ml,https://www.perfume24x7.com//collections/women/products/calvin-klein-escape-edp-for-women-100ml-1
Issey Miyake Pleats Please L'eau 100ml Eau De Toilette For Women,https://www.perfume24x7.com//collections/women/products/issey-miyake-pleats-please-for-women
Miss Dior Blooming Bouquet Eau De Toilette For Women,https://www.perfume24x7.com//collections/women/products/miss-dior-blooming-bouquet-edt-for-women
Carolina Herrera 212 Women NYC Deodorant 150ml,https://www.perfume24x7.com//collections/women/products/carolina-herrera-212-women-nyc-deodorant-150ml
Gucci Bloom Gocce Di Fiori EDT For Women 100ML,https://www.perfume24x7.com//collections/women/products/gucci-bloom-gocce-di-fiori-edt-for-women-100ml
Chanel No.5 L'Eau Eau De Toilette For Women 100ml,https://www.perfume24x7.com//collections/women/products/chanel-no-5-edp-for-women
Burberry My Burberry Eau De Parfum For Women 90 Ml,https://www.perfume24x7.com//collections/women/products/burberry-my-burberry-edp-for-women-90-ml
Burberry Body Eau De Parfum For Women 85ml,https://www.perfume24x7.com//collections/women/products/burberry-body-edp-for-women-85ml
Carolina Herrera 212 VIP Women Eau De Parfum 80ml,https://www.perfume24x7.com//collections/women/products/carolina-herrera-212-vip-women-edp-80ml
Estee Lauder Modern Muse Eau De Parfum For Women 100ml,https://www.perfume24x7.com//collections/women/products/estee-lauder-modern-muse-edp-for-women-100ml
Prada L'Femme Eau De Parfum For Women 100ml,https://www.perfume24x7.com//collections/women/products/prada-lfemme-edp-for-women-100-ml
Gucci Guilty Black Eau De Toilette For Women 75ml,https://www.perfume24x7.com//collections/women/products/gucci-guilty-black-edt-for-women-75ml
Chanel Coco Noir Eau De Parfum For Women 100ml,https://www.perfume24x7.com//collections/women/products/chanel-coco-noir-eau-de-parfum-for-women-100ml
Victoria's Secret Bombshell EDP For Women,https://www.perfume24x7.com//collections/women/products/victorias-secret-bombshell-edp-1
Coco Mademoiselle Chanel Eau De Parfum For Women 100ml,https://www.perfume24x7.com//collections/women/products/coco-mademoiselle-chanel-eau-de-parfum-for-women-100ml
Elizabeth Arden Always Red Femme Eau De Parfum For Women 100ml,https://www.perfume24x7.com//collections/women/products/elizabeth-arden-always-red-femme-edp-for-women-100ml
Mancera Paris Roses Vanilla Eau De Parfum 120ml,https://www.perfume24x7.com//collections/women/products/mancera-paris-roses-vanilla-edp-120ml
Gucci Flora Eau De Toilette for Women 75ml,https://www.perfume24x7.com//collections/women/products/gucci-flora-edt-for-women-75ml
Lattafa Qaa'ed Eau De Parfum For Men and Women 100ML,https://www.perfume24x7.com//collections/women/products/lattafa-tribute-najdia-eau-de-parfum-100ml
L'Extase Rose Absolue By Nina Ricci Eau De Parfum For Women 80ml,https://www.perfume24x7.com//collections/women/products/lextase-rose-absolue-by-nina-ricci-eau-de-parfum-for-women-80ml-1
Elizabeth Arden Red Door Shimmer Eau De Parfum For Women 100ML,https://www.perfume24x7.com//collections/women/products/elizabeth-arden-red-door-shimmer-eau-de-parfum-for-women-100ml
Tommy Hilfiger All Over Girl Body Deodorant Spray 200ml,https://www.perfume24x7.com//collections/women/products/tommy-hilfiger-all-over-girl-body-deodorant-spray-200ml
Versace Yellow Diamond Perfumed Deodorant for Women 50ml,https://www.perfume24x7.com//collections/women/products/versace-yellow-diamond-perfumed-deodorant-for-women-50ml
Victoria's Secret Love Addict Cloud Wash Foaming Gel Cleanser for Women 130gm,https://www.perfume24x7.com//collections/women/products/victorias-secret-love-addict-cloud-wash-foaming-gel-cleanser-for-women-130gm
Victorias Secret Tease Silk Shower Oil 250ml,https://www.perfume24x7.com//collections/women/products/victorias-secret-tease-silk-shower-oil-250ml
Victoria's Secret Tease Eau De Parfum For Women 100ml,https://www.perfume24x7.com//collections/women/products/victorias-secret-tease-eau-de-parfum-for-women-100ml
Victoria's Secret Bombshell Seduction Eau De Parfum 4pc Gift Set For Women,https://www.perfume24x7.com//collections/women/products/victorias-secret-bombshell-seduction-eau-de-parfum-4pc-gift-set-for-women
United Colors of Benetton United Dreams Live Free Eau De Toilette For Her Gift set,https://www.perfume24x7.com//collections/women/products/united-colors-of-benetton-united-dreams-live-free-eau-de-toilette-for-her-gift-set
Victoria's Secret Tease Petal Scrub For Women 283gm,https://www.perfume24x7.com//collections/women/products/victorias-secret-tease-petal-scrub-for-women-283gm
Victoria's Secret Bombshell Gold Eau de Parfum For Women 50ML,https://www.perfume24x7.com//collections/women/products/victorias-secret-bombshell-gold-eau-de-parfum-for-women-50ml
Paris Hilton Can Can EDP For Women 100ml,https://www.perfume24x7.com//collections/women/products/paris-hilton-can-can-women-edp
Lancome Miracle Eau De Parfum For Women 100ml,https://www.perfume24x7.com//collections/women/products/lancome-miracle-women-edp
Salvatore Ferragamo Attimo L Eau' Florale Eau De Toilette 100ml,https://www.perfume24x7.com//collections/women/products/salvatore-ferragamo-attimo-l-florale-edt-100ml
Victoria's Secret Noir Tease Eau De Parfum For Women 100ml,https://www.perfume24x7.com//collections/women/products/victorias-secret-noir-tease-edp-for-women-100ml
Victoria's Secret Love Me Eau De Parfum For Women 100ml,https://www.perfume24x7.com//collections/women/products/victorias-secret-love-me-eau-de-parfum-for-women-100ml
Victoria's Secret Angel Gold EDP For Women,https://www.perfume24x7.com//collections/women/products/victorias-secret-angel-gold-edp-for-women-50ml
