perfume_name,perfume_link
Salvatore Ferragamo Incanto Charms Eau De Toilette For Women 100ml,https://www.perfume24x7.com//collections/women/products/salvatore-ferragamo-incanto-charm-edt-for-women-100ml
Narciso Rodriguez Pure Musc Eau De Parfum For Women 100ML,https://www.perfume24x7.com//collections/women/products/narciso-rodriguez-pure-musc-eau-de-parfum-for-women-100ml
Burberry Brit Sheer Eau De Toilette For Women 100ml,https://www.perfume24x7.com//collections/women/products/burberry-brit-sheer-edt-for-women-100ml
Estee Lauder Modern Muse Nuit Le Rouge Eau De Parfum For Women 100ml,https://www.perfume24x7.com//collections/women/products/estee-lauder-modern-muse-nuit-le-rouge-eau-de-parfum-for-women-100ml
Victoria's Secret Coconut Passion Refreshing Gel Body Wash for Women 300ml,https://www.perfume24x7.com//collections/women/products/victorias-secret-coconut-passion-refreshing-gel-body-wash-for-women-300ml
Guess By Marciano Eau De Parfum For Women 100ml,https://www.perfume24x7.com//collections/women/products/guess-by-marciano-edp-for-women-100ml
Calvin Klein Obsessed Eau De Parfum For Women 100ML,https://www.perfume24x7.com//collections/women/products/calvin-klein-obsessed-eau-de-parfum-for-women-100ml
Twilly D'Hermes Eau De Parfum For Women 85ml,https://www.perfume24x7.com//collections/women/products/twilly-dhermes-eau-de-parfum-for-women-85ml
Victoria's Secret Bombshell Pink Diamonds EDP For Women 50ml,https://www.perfume24x7.com//collections/women/products/victorias-secret-bombshell-pink-diamonds-edp-for-women-50ml
Elizabeth Arden Red Door Revealed Eau De Parfum For Women 100ml,https://www.perfume24x7.com//collections/women/products/elizabeth-arden-red-door-revealed-eau-de-parfum-for-women-100ml
Calvin Klein Beauty Eau De Parfum For Women 100ml,https://www.perfume24x7.com//collections/women/products/calvin-klein-beauty-for-women
Carolina Herrera Good Girl For Women Eau De Parfum,https://www.perfume24x7.com//collections/women/products/carolina-herrera-good-girl-for-women-80ml-edp-1
Calvin Klein CK Eternity Summer Daze Eau De Parfum For Women 100ml,https://www.perfume24x7.com//collections/women/products/calvin-klein-ck-eternity-summer-daze-eau-de-parfum-for-women-100ml
Lacoste Pour Femme Eau De Parfum For Women 90ml,https://www.perfume24x7.com//collections/women/products/lacoste-pour-femme-edt-for-women-100ml-1
Victoria's Secret Bombshell New York Eau de Parfum For Women 50ml,https://www.perfume24x7.com//collections/women/products/victorias-secret-bombshell-new-york-edp-for-women-50ml
Victoria's Secret Bombshell Oud EDP For Women,https://www.perfume24x7.com//collections/women/products/victorias-secret-bombshell-oud-edp-for-women
Victoria's Secret Angel Gold Eau De Parfum 50ML Gift Set For Women,https://www.perfume24x7.com//collections/women/products/victorias-secret-angel-gold-eau-de-parfum-50ml-gift-set-for-women
Chopard Wish Eau De Parfum For Women 75ml,https://www.perfume24x7.com//collections/women/products/chopard-rose-malaki-eau-de-parfum-80ml
Burberry Body Tender Eau De Toilette For Women,https://www.perfume24x7.com//collections/women/products/burberry-body-tender-edt-for-women-85ml
Bvlgari Omnia Jewel Charms 3pc Miniature Spray Travel Collection 45ml,https://www.perfume24x7.com//collections/women/products/bvlgari-omnia-jewel-charms-3pc-mini-spray-travel-collection-45ml
Victoria's Secret Bombshell Passion Eau De Parfum 100ml For Women,https://www.perfume24x7.com//collections/women/products/victorias-secret-bombshell-passion-eau-de-parfum-100ml-for-women
Bvlgari Omnia Floral By Mary Katrantzou Eau De Parfum 65ml,https://www.perfume24x7.com//collections/women/products/bvlgari-mary-katrantzou-omnia-floral-eau-de-parfum
Boss Intense Eau De Parfum For Women,https://www.perfume24x7.com//collections/women/products/boss-intense-for-women
Davidoff Coolwater Intense Eau De Parfum For Women 100ml,https://www.perfume24x7.com//collections/women/products/davidoff-coolwater-intense-edp-for-women-100ml
Elizabeth Taylor White Diamonds EDT For Women 100ml,https://www.perfume24x7.com//collections/women/products/elizabeth-taylor-white-diamonds-for-women
Lancome La Vie Est Belle Eau De Parfum For Woman,https://www.perfume24x7.com//collections/women/products/lancome-is-vie-est-belle-edp
Elizabeth Taylor Forever Elizabeth Eau De Parfum For Women 100ml,https://www.perfume24x7.com//collections/women/products/elizabeth-arden-forever-elizabeth-eau-de-parfum-for-women-100ml
Victoria's Secret Pure Seduction Refreshing Gel Body Wash for Women 300ml,https://www.perfume24x7.com//collections/women/products/victorias-secret-pure-seduction-refreshing-gel-body-wash-for-women-300ml
Giorgio Armani Si Passione Eau De Parfum For Women,https://www.perfume24x7.com//collections/women/products/giorgio-armani-si-passione-edp-for-women-100ml
Victoria's Secret Very Sexy EDP For Women 100ml,https://www.perfume24x7.com//collections/women/products/victorias-secret-very-sexy-edp-for-women-100ml
Victoria's Secret Very Sexy Eau De Parfum 2pc Gift Set,https://www.perfume24x7.com//collections/women/products/victorias-secret-very-sexy-eau-de-parfum-2pc-gift-set
Hugo Boss Women Eau De Parfum For Women 90ml,https://www.perfume24x7.com//collections/women/products/hugo-boss-women-eau-de-parfum-for-women-90ml
Mont Blanc Legend Pour Femme Special Edition Eau De Toilette For Women 75ml,https://www.perfume24x7.com//collections/women/products/mont-blanc-legend-pour-femme-eau-de-toilette-for-women
Burberry Weekend Eau De Parfum For Women For 100ml,https://www.perfume24x7.com//collections/women/products/burberry-weekend-edp-for-women-for-100ml-new-pack
DKNY Be Delicious Eau De Parfum For Women 3pc Gift Set 107 ML,https://www.perfume24x7.com//collections/women/products/dkny-energizing-eau-de-parfum-for-women-100ml
Mugler Alien Fusion La Nouvelle Eau De Parfum 60 ML,https://www.perfume24x7.com//collections/women/products/mugler-alien-fusion-la-nouvelle-edp-60-ml
Versace Versense Eau De Toilette For Women 100ml,https://www.perfume24x7.com//collections/women/products/versace-versense-eau-de-toilette-for-women-100ml
Ricci Ricci By Nina Ricci Eau De Parfum For Women 80ml,https://www.perfume24x7.com//collections/women/products/ricci-ricci-by-nina-ricci-edp-for-women-80ml
Armaf Club De Nuit Milestone Eau De Parfum 105ml,https://www.perfume24x7.com//collections/women/products/armaf-club-de-nuit-milestone-edp-for-men-105ml
Calvin Klein CK Woman Eau De Parfum 100ml,https://www.perfume24x7.com//collections/women/products/calvin-klein-woman-edp-100ml
Elizabeth Arden Green Tea Lotus Eau De Toilette For Women 100ml,https://www.perfume24x7.com//collections/women/products/elizabeth-arden-green-tea-lotus-edt-for-women-100ml
United Colors of Benetton Colors Holo Eau De Toilette For Woman 80ml,https://www.perfume24x7.com//collections/women/products/united-colors-of-benetton-colors-holo-edt-for-woman-80ml
Britney Spears Midnight Fantasy Eau De Parfum for Women 100ml,https://www.perfume24x7.com//collections/women/products/britney-spears-midnight-fantasy-eau-de-parfum-for-women-100ml
United Colors of Benetton Colors Pink Eau De Toilette  For Her 80ml,https://www.perfume24x7.com//collections/women/products/ucb-colors-pink-edt-for-her-80ml
Gucci Guilty Oud Eau De Parfum 90ml,https://www.perfume24x7.com//collections/women/products/gucci-guilty-oud-pour-homme-edp-90ml
Giorgio Armani Si Passione Eclat Eau De Parfum For Women,https://www.perfume24x7.com//collections/women/products/giorgio-armani-si-passione-eclat-eau-de-parfum-for-women-100ml
Eternal Love X Louis Eau De Parfum For Women 100ml,https://www.perfume24x7.com//collections/women/products/eternal-love-x-louis-edp-for-women-100ml
Tommy Girl Eau De Toilette For Women 100ml,https://www.perfume24x7.com//collections/women/products/tommy-girl-edt
Chanel Chance Eau De Parfum For Women 100ml,https://www.perfume24x7.com//collections/women/products/chanel-chance-eau-de-parfum-for-women-100ml
Chopard Black Incense Malaki Eau De Parfum 80ML,https://www.perfume24x7.com//collections/women/products/chopard-black-incense-malaki-eau-de-parfum-80ml
Lanvin Marry Me Eau De Parfum 75ml For Women,https://www.perfume24x7.com//collections/women/products/lanvin-marry-me-edp-75ml-for-women
Paco Rabanne Lady Million Deodorant For Women 150ml,https://www.perfume24x7.com//collections/women/products/paco-rabanne-lady-million-deodorant-for-women-150ml
Victoria's Secret Bombshell Wild Flower EDP For Women 100ml,https://www.perfume24x7.com//collections/women/products/victorias-secret-bombshell-wild-flower-edp-for-women-100ml
Hugo Boss XX Eau De Toilette For Women 100ml,https://www.perfume24x7.com//collections/women/products/hugo-boss-xx-edt-for-women-100ml
Bvlgari Omnia EDT Miniature Pack For Women (Amethyste & Crystalline) 10ML,https://www.perfume24x7.com//collections/women/products/bvlgari-omnia-2pc-miniature-collection-eau-de-toilette-for-women
HUGO BOSS Woman Extreme Eau De Parfum 75ML,https://www.perfume24x7.com//collections/women/products/hugo-boss-woman-extreme-eau-de-parfum-75ml
Guess Eau De Parfum 3Pc Gift Set For Women 100ml,https://www.perfume24x7.com//collections/women/products/guess-eau-de-parfum-3pc-gift-set-for-women-100ml
Elizabeth Arden White Tea Eau De Toilette For Women 100ml,https://www.perfume24x7.com//collections/women/products/elizabeth-arden-white-tea-edt-for-women-100ml
Guess Bella Vita Eau De Parfum For Women 100ml,https://www.perfume24x7.com//collections/women/products/guess-bella-vita-eau-de-parfum-for-women-100ml
Versace Eros Pour Femme Eau De Toilette 100ml For Women,https://www.perfume24x7.com//collections/women/products/versace-eros-pour-femme-edt-100ml-for-women
Burberry Brit Eau De Parfum For Women 100ml,https://www.perfume24x7.com//collections/women/products/burberry-brit-eau-de-parfum-for-women-100ml
Jimmy Choo Illicit Flower Eau De Toilette For Women 100 ML,https://www.perfume24x7.com//collections/women/products/jimmy-choo-illicit-flower-edt-for-women-100-ml
Giorgio Armani My Way Eau De Parfum For Women,https://www.perfume24x7.com//collections/women/products/giorgio-armani-my-way-eau-de-parfum-for-women
Victoria's Secret Temptation Cloud Wash Foaming Gel Cleanser for Women 130gm,https://www.perfume24x7.com//collections/women/products/victorias-secret-temptation-cloud-wash-foaming-gel-cleanser-for-women-130gm
Guess Girl Eau De Toilette For Women For 100ml,https://www.perfume24x7.com//collections/women/products/guess-girl-edt
Tommy Hilfiger Girl Eau De Toilette 2pc Gift Set,https://www.perfume24x7.com//collections/women/products/tommy-hilfiger-girl-eau-de-toilette-2pc-gift-set
Twilly D'Hermes Eau Ginger Eau De Parfum For Women 85ml,https://www.perfume24x7.com//collections/women/products/twilly-dhermes-eau-ginger-eau-de-parfum-for-women-85ml
Rasasi Shuhrah Pour Femme Eau De Parfum 90ml,https://www.perfume24x7.com//collections/women/products/rasasi-shuhrah-pour-femme-edp-90ml-edp
Victoria's Secret Night EDP For Women 50ml,https://www.perfume24x7.com//collections/women/products/victorias-secret-night-edp-for-women-50ml
Nina By Nina Ricci Eau De Toilette For Women 80ml,https://www.perfume24x7.com//collections/women/products/nina-by-nina-ricci-edt-for-women-80ml
Davidoff Cool Water Street Fighter Champion Edition Eau De Toilette For Women 100ML,https://www.perfume24x7.com//collections/women/products/davidoff-cool-water-street-fighter-champion-edition-eau-de-toilette-for-her
Prada Candy Kiss Eau De Parfum For Women 80 Ml,https://www.perfume24x7.com//collections/women/products/prada-candy-kiss-edp-for-women-80-ml
Titan Skinn Verge & Sheer Mini Gift Set EDP 50ml,https://www.perfume24x7.com//collections/women/products/titan-skinn-verge-sheer-mini-gift-set-edp-50ml
Narciso Rodriguez Fleur Musc Eau De Parfum For Women,https://www.perfume24x7.com//collections/women/products/narciso-rodriguez-fleur-musc-edp-for-women
Versace Bright Crystal Absolu Eau De Parfum 90ml For Women,https://www.perfume24x7.com//collections/women/products/versace-bright-crystal-absolute-edp-90ml-for-women
Abercrombie Fitch Fierce For Women Eau de Parfum 50ml,https://www.perfume24x7.com//collections/women/products/abercrombie-fitch-fierce-mens-eau-de-parfum-50ml
Calvin Klein Obsession Night Eau De Parfum For Women 100ml,https://www.perfume24x7.com//collections/women/products/calvin-klein-obsession-night-eau-de-parfum-for-women-100ml
Issey Miyake Leau Dissey For Women 100ml Eau De Toilette,https://www.perfume24x7.com//collections/women/products/issey-miyake-leau-dissey-for-women
United Colors of Benetton United Dreams Stay Positive Eau De Toilette For Women 80ml,https://www.perfume24x7.com//collections/women/products/united-colors-of-benetton-united-dreams-stay-positive-edt-for-women-100ml
Bvlgari Omnia 5pc Miniature Travel Collection 25ml,https://www.perfume24x7.com//collections/women/products/bvlgari-omnia-3pc-mini-travel-collection-5ml-each
Paco Rabanne Olympea Eau De Parfum For Women 80ml,https://www.perfume24x7.com//collections/women/products/paco-rabanne-olympea-eau-de-parfum-for-women-80ml
Hugo Boss The Scent Private Accord Eau De Parfum For Women,https://www.perfume24x7.com//collections/women/products/hugo-boss-the-scent-private-accord-edp-for-women-100ml
Victoria's Secret Bombshell Intense EDP For Women,https://www.perfume24x7.com//collections/women/products/victorias-secret-bombshell-intense-edp-for-women
Elizabeth Arden True Love Eau De Toilette For Women 100ml,https://www.perfume24x7.com//collections/women/products/elizabeth-arden-true-love-edt-for-women-100ml
Versace Crystal Noir Eau De Toilette For Women 90ml,https://www.perfume24x7.com//collections/women/products/versace-crystal-noir-edt-for-women-90ml
Issey Miyake L'eau D'Issey Pure Petale De Nector Eau De Toilette 90 ML For Women,https://www.perfume24x7.com//collections/women/products/issey-miyake-leau-dissey-pure-petale-de-nector-edp-90-ml-for-women
Gucci Bloom Eau De Parfum for Women by Gucci 100ml,https://www.perfume24x7.com//collections/women/products/gucci-bloom-edp-for-women-by-gucci-100ml
Victoria's Secret Bombshell Summer Eau De Parfum For Women,https://www.perfume24x7.com//collections/women/products/victorias-secret-bombshell-summer-edp-for-women-100ml-1
Victoria's Secret Very Sexy Sea Eau De Parfum RollerBall 7ml For Women,https://www.perfume24x7.com//collections/women/products/victorias-secret-very-sexy-sea-edp-rollerball-7ml-for-women
Calvin Klein CK Eternity Flame Eau De Parfum For Women 100ML,https://www.perfume24x7.com//collections/women/products/calvin-klein-ck-eternity-flame-eau-de-parfum-for-women-100ml
Issey Miyake L'Eau d'Issey Pure Eau De Parfum 90 ML For Women,https://www.perfume24x7.com//collections/women/products/issey-miyake-pure-edp-90-ml-for-women
Estee Lauder Pleasures Eau De Parfum For Women 100ml,https://www.perfume24x7.com//collections/women/products/estee-lauder-pleasures-edp-for-women-100ml
United Colors of Benetton Colors Purple Eau De Toilette For Her 80ml,https://www.perfume24x7.com//collections/women/products/ucb-colors-purple-edt-for-her-80ml
Titan Skinn Nude Eau De Parfum For Women,https://www.perfume24x7.com//collections/women/products/titan-nude-women
Antonio Banderas Her Secret Temptation Eau De Toilette 80 Ml,https://www.perfume24x7.com//collections/women/products/antonio-banderas-her-secret-temptation-edt-80-ml
Jovan Musk Cologne Concentrate Spray For Women,https://www.perfume24x7.com//collections/women/products/jovan-musk-cologne-for-women-96ml
Versace Vanitas Eau De Parfum For Women 100ml,https://www.perfume24x7.com//collections/women/products/versace-vanitas-edp-for-women-100ml
Nina Ricci Les Belles De Nina Fresh Deodorant Spray For Women 150ml,https://www.perfume24x7.com//collections/women/products/nina-ricci-les-belles-de-nina-fresh-deodorant-spray-for-women
Givenchy Organza Eau De Parfum For Women 100ml,https://www.perfume24x7.com//collections/women/products/givenchy-organza-edp-for-women
FCUK Late Night Eau De Toilette For Women 100ml,https://www.perfume24x7.com//collections/women/products/fcuk-late-night-edt-for-women-100ml
United Colors of Benetton United Dreams Love Yourself Eau De Toilette For Women 80ml,https://www.perfume24x7.com//collections/women/products/ucb-united-dreams-for-women
Lanvin Marry Me Eau De Parfum 75ml For Women,https://www.perfume24x7.com//collections/women/products/lanvin-marry-me-edp-75ml-for-women
Chopard Black Incense Malaki Eau De Parfum 80ML,https://www.perfume24x7.com//collections/women/products/chopard-black-incense-malaki-eau-de-parfum-80ml
Chanel Chance Eau De Parfum For Women 100ml,https://www.perfume24x7.com//collections/women/products/chanel-chance-eau-de-parfum-for-women-100ml
Tommy Girl Eau De Toilette For Women 100ml,https://www.perfume24x7.com//collections/women/products/tommy-girl-edt
Eternal Love X Louis Eau De Parfum For Women 100ml,https://www.perfume24x7.com//collections/women/products/eternal-love-x-louis-edp-for-women-100ml
Giorgio Armani Si Passione Eclat Eau De Parfum For Women,https://www.perfume24x7.com//collections/women/products/giorgio-armani-si-passione-eclat-eau-de-parfum-for-women-100ml
Gucci Guilty Oud Eau De Parfum 90ml,https://www.perfume24x7.com//collections/women/products/gucci-guilty-oud-pour-homme-edp-90ml
Elizabeth Arden Green Tea Lotus Eau De Toilette For Women 100ml,https://www.perfume24x7.com//collections/women/products/elizabeth-arden-green-tea-lotus-edt-for-women-100ml
United Colors of Benetton Colors Holo Eau De Toilette For Woman 80ml,https://www.perfume24x7.com//collections/women/products/united-colors-of-benetton-colors-holo-edt-for-woman-80ml
Calvin Klein CK Woman Eau De Parfum 100ml,https://www.perfume24x7.com//collections/women/products/calvin-klein-woman-edp-100ml
Armaf Club De Nuit Milestone Eau De Parfum 105ml,https://www.perfume24x7.com//collections/women/products/armaf-club-de-nuit-milestone-edp-for-men-105ml
Britney Spears Midnight Fantasy Eau De Parfum for Women 100ml,https://www.perfume24x7.com//collections/women/products/britney-spears-midnight-fantasy-eau-de-parfum-for-women-100ml
United Colors of Benetton Colors Pink Eau De Toilette  For Her 80ml,https://www.perfume24x7.com//collections/women/products/ucb-colors-pink-edt-for-her-80ml
Ricci Ricci By Nina Ricci Eau De Parfum For Women 80ml,https://www.perfume24x7.com//collections/women/products/ricci-ricci-by-nina-ricci-edp-for-women-80ml
Versace Versense Eau De Toilette For Women 100ml,https://www.perfume24x7.com//collections/women/products/versace-versense-eau-de-toilette-for-women-100ml
Victoria's Secret Very Sexy Eau De Parfum 2pc Gift Set,https://www.perfume24x7.com//collections/women/products/victorias-secret-very-sexy-eau-de-parfum-2pc-gift-set
Hugo Boss Women Eau De Parfum For Women 90ml,https://www.perfume24x7.com//collections/women/products/hugo-boss-women-eau-de-parfum-for-women-90ml
DKNY Be Delicious Eau De Parfum For Women 3pc Gift Set 107 ML,https://www.perfume24x7.com//collections/women/products/dkny-energizing-eau-de-parfum-for-women-100ml
Mugler Alien Fusion La Nouvelle Eau De Parfum 60 ML,https://www.perfume24x7.com//collections/women/products/mugler-alien-fusion-la-nouvelle-edp-60-ml
Burberry Weekend Eau De Parfum For Women For 100ml,https://www.perfume24x7.com//collections/women/products/burberry-weekend-edp-for-women-for-100ml-new-pack
Mont Blanc Legend Pour Femme Special Edition Eau De Toilette For Women 75ml,https://www.perfume24x7.com//collections/women/products/mont-blanc-legend-pour-femme-eau-de-toilette-for-women
Victoria's Secret Very Sexy EDP For Women 100ml,https://www.perfume24x7.com//collections/women/products/victorias-secret-very-sexy-edp-for-women-100ml
Giorgio Armani Si Passione Eau De Parfum For Women,https://www.perfume24x7.com//collections/women/products/giorgio-armani-si-passione-edp-for-women-100ml
United Colors of Benetton United Dreams Love Yourself Eau De Toilette For Women 80ml,https://www.perfume24x7.com//collections/women/products/ucb-united-dreams-for-women
Givenchy Organza Eau De Parfum For Women 100ml,https://www.perfume24x7.com//collections/women/products/givenchy-organza-edp-for-women
Versace Vanitas Eau De Parfum For Women 100ml,https://www.perfume24x7.com//collections/women/products/versace-vanitas-edp-for-women-100ml
Antonio Banderas Her Secret Temptation Eau De Toilette 80 Ml,https://www.perfume24x7.com//collections/women/products/antonio-banderas-her-secret-temptation-edt-80-ml
Nina Ricci Les Belles De Nina Fresh Deodorant Spray For Women 150ml,https://www.perfume24x7.com//collections/women/products/nina-ricci-les-belles-de-nina-fresh-deodorant-spray-for-women
Jovan Musk Cologne Concentrate Spray For Women,https://www.perfume24x7.com//collections/women/products/jovan-musk-cologne-for-women-96ml
FCUK Late Night Eau De Toilette For Women 100ml,https://www.perfume24x7.com//collections/women/products/fcuk-late-night-edt-for-women-100ml
Luna Blossom By Nina Ricci Eau De Toilette For Women 80ml,https://www.perfume24x7.com//collections/women/products/luna-blossom-by-nina-ricci-edt-for-women-80ml
Titan Skinn Nude Eau De Parfum For Women,https://www.perfume24x7.com//collections/women/products/titan-nude-women
United Colors of Benetton Colors Purple Eau De Toilette For Her 80ml,https://www.perfume24x7.com//collections/women/products/ucb-colors-purple-edt-for-her-80ml
Estee Lauder Pleasures Eau De Parfum For Women 100ml,https://www.perfume24x7.com//collections/women/products/estee-lauder-pleasures-edp-for-women-100ml
Victoria's Secret Bombshell Paris Eau De Parfum For Women 100ml,https://www.perfume24x7.com//collections/women/products/victorias-secret-bombshell-paris-edp-for-women-100ml
Paco Rabanne Lady Million Eau De Parfum For Women 80ml,https://www.perfume24x7.com//collections/women/products/paco-rabanne-lady-million-edp-80ml-for-women
Mont Blanc Lady Emblem Elixir 75 Ml Eau De Parfum For Women,https://www.perfume24x7.com//collections/women/products/mont-blanc-lady-emblem-elixir-75-ml-edp-for-women
Versace Bright Crystal Perfumed Deodorant for Women 50ml,https://www.perfume24x7.com//collections/women/products/versace-bright-crystal-perfumed-deodorant-for-women-50ml
Britney Spears Fantasy Eau De Parfum for Women 100ml,https://www.perfume24x7.com//collections/women/products/britney-spears-fantasy-edp-for-women-100ml
United Colors of Benetton United Dreams Together Eau De Toilette For Women 80ml,https://www.perfume24x7.com//collections/women/products/united-colors-of-benetton-united-dreams-together-edt-for-women-80ml
Victoria's Secret Tease Dreamer EDP For Women 50ml,https://www.perfume24x7.com//collections/women/products/victorias-secret-tease-dreamer-edp-for-women-50ml
Arden Beauty Eau De Parfum By Elizabeth Arden For Women 100ML,https://www.perfume24x7.com//collections/women/products/elizabeth-arden-arden-beauty-edp
Lacoste Love of Pink Eau De Toilette For Women 90ml,https://www.perfume24x7.com//collections/women/products/lacoste-love-of-pink-eau-de-toilette-for-women-90ml
Guess 1981 Indigo Eau de Toilette For Women 100ml,https://www.perfume24x7.com//collections/women/products/guess-1981-indigo-eau-de-toilette-for-women-100ml
Calvin Klein CK One Gold Eau De Toilette,https://www.perfume24x7.com//collections/women/products/calvin-klein-one-gold-edt-200ml
United Colors of Benetton United Dream Big Eau De Toilette For Women 80ml,https://www.perfume24x7.com//collections/women/products/united-colors-of-benetton-united-dream-big-edt-for-women-80ml
Woman By Ralph Lauren Eau De Parfum 100ml,https://www.perfume24x7.com//collections/women/products/woman-by-ralph-lauren-edp-100ml
Ramz Lattafa Eau De Parfum Natural Spray 100ML,https://www.perfume24x7.com//collections/women/products/rama-lattafa-eau-de-parfum-natural-spray-for-men-100ml
Clinique Happy Parfum Spray For Women 100ML,https://www.perfume24x7.com//collections/women/products/clinique-happy-parfum-spray-for-women-100ml
Victoria's Secret Very Sexy Orchid Eau De Parfum RollerBall 7ml For Women,https://www.perfume24x7.com//collections/women/products/victorias-secret-very-sexy-orchid-edp-rollerball-7ml-for-women
Victoria's Secret Velvet Petals Cloud Wash Foaming Gel Cleanser for Women 130gm,https://www.perfume24x7.com//collections/women/products/victorias-secret-velvet-petals-cloud-wash-foaming-gel-cleanser-for-women
Reno By Ralph Lauren Eau De Toilette For Women 100ML,https://www.perfume24x7.com//collections/women/products/ralph-lauren-reno-eau-de-toilette-for-men-100ml
United Colors of Benetton Colors Woman Rose Eau De Toilette 80ml,https://www.perfume24x7.com//collections/women/products/united-colors-of-benetton-colors-woman-rose-eau-de-toilette-for-women-80ml
Victoria's Secret Love Spell Refreshing Gel Body Wash for Women 300ml,https://www.perfume24x7.com//collections/women/products/victorias-secret-love-spell-refreshing-gel-body-wash-for-women-300ml
Jovan Black Musk Cologne For Women 96ml,https://www.perfume24x7.com//collections/women/products/jovan-black-musk-cologne-for-women-96ml
Calvin Klein CK Miniature Travel Collection For Women 4pc Spray 15ml each,https://www.perfume24x7.com//collections/women/products/calvin-klein-miniature-deluxe-travel-collection-for-women-4pc-spray-15ml-each
United Colors of Benetton Sports Eau De Toilette  For Women 100ml,https://www.perfume24x7.com//collections/women/products/benetton-sports-for-women
Rasasi Dareez Pour Femme Eau De Parfum For Women 100ml,https://www.perfume24x7.com//collections/women/products/rasasi-dareez-pour-femme-edp-for-women-100ml
Gucci Bamboo Eau De Parfum For Women 75ml,https://www.perfume24x7.com//collections/women/products/gucci-bamboo-eau-de-parfum-for-women-75ml
Birra Affluence Eau De Parfum For Men & Women 100ml,https://www.perfume24x7.com//collections/women/products/birra-affluence-eau-de-parfum-for-men-women-100ml
Calvin Klein CK Eternity Summer Eau De Parfum For Women 100ml,https://www.perfume24x7.com//collections/women/products/calvin-klein-ck-eternity-summer-eau-de-parfum-for-women-100ml
Gucci Bloom Eau De Parfum for Women by Gucci 100ml,https://www.perfume24x7.com//collections/women/products/gucci-bloom-edp-for-women-by-gucci-100ml
