perfume_name,perfume_link
Armaf Club De Nuit Intense Eau De Parfum For Women 105ml,https://www.perfume24x7.com//collections/women/products/armaf-club-de-nuit-intense-for-women-105ml-edt
Versace Yellow Diamond Eau De Toilette For Women 90ml,https://www.perfume24x7.com//collections/women/products/versace-yellow-diamond-edt-w
Creed Sillver Mountain Water Eau De Perfum 100ml,https://www.perfume24x7.com//collections/women/products/creed-sillver-mountain-water-eau-de-perfum-100ml
Dolce & Gabbana Light Blue Eau Intense Eau De Parfum For Women 100ml,https://www.perfume24x7.com//collections/women/products/dolce-gabbana-light-blue-eau-intense-edp-for-women-100ml
Versace Dylan Blue Pour Femme Eau De Parfum 100ml For Women,https://www.perfume24x7.com//collections/women/products/versace-dylan-blue-pour-femme-edp-100ml-for-women
Dolce & Gabbana Pour Femme Eau De Parfum For Women 100ML,https://www.perfume24x7.com//collections/women/products/dolce-gabbana-pour-femme-edp-for-women-100ml
Ralph Lauren Romance Eau De Parfum For Women,https://www.perfume24x7.com//collections/women/products/ralph-lauren-romance-edp-for-women-100ml
Calvin Klein CK Eternity Eau De Parfum  For Women 100ml,https://www.perfume24x7.com//collections/women/products/calvin-klein-eternity-edp-for-women-100ml
Davidoff Coolwater Sea Rose Eau De Toilette For Women 100ml,https://www.perfume24x7.com//collections/women/products/davidoff-coolwater-sea-rose-for-women
Bvlgari Omnia Crystalline Eau De Toilette For Women,https://www.perfume24x7.com//collections/women/products/bvlgari-omnia-crystalline-edt-for-women-65ml
Kenzo Flower Eau de Parfum For Women,https://www.perfume24x7.com//collections/women/products/kenzo-flower-for-women
Elizabeth Arden Pretty Eau De Parfum For Women 100ml,https://www.perfume24x7.com//collections/women/products/elizabeth-arden-pretty-eau-de-parfum-for-women-100ml
Britney Spears Curious Eau De Parfum For Women 100ml,https://www.perfume24x7.com//collections/women/products/britney-spears-curious-for-women
Versace Crystal Noir Eau de Parfum For Women 90ML,https://www.perfume24x7.com//collections/women/products/versace-crystal-noir-eau-de-parfum-for-women-90ml
Estee Lauder Modern Muse Nuit Eau De Parfum For Women,https://www.perfume24x7.com//collections/women/products/estee-lauder-modern-muse-nuit-edp-for-women-100ml
Calvin Klein CK Euphoria Eau De Parfum For Women 100ml,https://www.perfume24x7.com//collections/women/products/euphoria-edp-by-calvin-klein
Salvatore Ferragamo STORIE DI SETA Discovery Kit For Women (4x15ML),https://www.perfume24x7.com//collections/women/products/salvatore-ferragamo-storie-di-seta-discovery-kit-for-women-4x15ml
Bvlgari Omnia Coral Eau De Toilette For Women 65ml,https://www.perfume24x7.com//collections/women/products/bvlgari-omnia-coral-edt-for-women-65ml
Narciso Rodriguez Eau De Toilette For Her,https://www.perfume24x7.com//collections/women/products/narciso-rodriguez-eau-de-toilette-for-her
Chopard Musk Malaki Eau De Parfum 80ml,https://www.perfume24x7.com//collections/women/products/chopard-musk-malaki-eau-de-parfum-80ml
Armaf Club De Nuit Sillage Eau De Parfum 105ml,https://www.perfume24x7.com//collections/women/products/armaf-club-de-nuit-sillage-edp-105ml
UCB Sisterland Pink Raspberry Eau De Toilette For Women 80ml,https://www.perfume24x7.com//collections/women/products/ucb-sisterland-pink-raspberry-edt-for-women-80ml
Jimmy Choo Eau De Toilette For Women 100 ML,https://www.perfume24x7.com//collections/women/products/jimmy-choo-edt-for-women-100-ml
Paco Rabanne Fame Eau De Parfum For Women 80ml,https://www.perfume24x7.com//collections/women/products/paco-rabanne-fame-eau-de-parfum-for-women-80ml
Titan Skinn Raw & Celeste Him & Her Gift Set,https://www.perfume24x7.com//collections/women/products/titan-skinn-raw-celeste-him-her-gift-set-50ml
Estee Lauder Beautiful Eau De Parfum For Women 75ml,https://www.perfume24x7.com//collections/women/products/estee-lauder-beautiful-edp-for-women-75ml
Guess Eau De Parfum For Women 75ml,https://www.perfume24x7.com//collections/women/products/guess-pink-for-women
Bvlgari Omnia Indian Garnet Miniature Spray Eau De Toilette For Women 15ML,https://www.perfume24x7.com//collections/women/products/bvlgari-omnia-indian-garnet-miniature-spray-eau-de-toilette-for-women-15ml
Versace Dylan Blue Pour Femme Eau De Parfum 100ml For Women,https://www.perfume24x7.com//collections/women/products/versace-dylan-blue-pour-femme-edp-100ml-for-women
Creed Sillver Mountain Water Eau De Perfum 100ml,https://www.perfume24x7.com//collections/women/products/creed-sillver-mountain-water-eau-de-perfum-100ml
Versace Yellow Diamond Eau De Toilette For Women 90ml,https://www.perfume24x7.com//collections/women/products/versace-yellow-diamond-edt-w
Narciso Rodriguez Eau De Toilette For Her,https://www.perfume24x7.com//collections/women/products/narciso-rodriguez-eau-de-toilette-for-her
Dolce & Gabbana Light Blue Eau Intense Eau De Parfum For Women 100ml,https://www.perfume24x7.com//collections/women/products/dolce-gabbana-light-blue-eau-intense-edp-for-women-100ml
Bvlgari Omnia Coral Eau De Toilette For Women 65ml,https://www.perfume24x7.com//collections/women/products/bvlgari-omnia-coral-edt-for-women-65ml
Armaf Club De Nuit Intense Eau De Parfum For Women 105ml,https://www.perfume24x7.com//collections/women/products/armaf-club-de-nuit-intense-for-women-105ml-edt
Salvatore Ferragamo STORIE DI SETA Discovery Kit For Women (4x15ML),https://www.perfume24x7.com//collections/women/products/salvatore-ferragamo-storie-di-seta-discovery-kit-for-women-4x15ml
Davidoff Coolwater Sea Rose Eau De Toilette For Women 100ml,https://www.perfume24x7.com//collections/women/products/davidoff-coolwater-sea-rose-for-women
Elizabeth Arden Pretty Eau De Parfum For Women 100ml,https://www.perfume24x7.com//collections/women/products/elizabeth-arden-pretty-eau-de-parfum-for-women-100ml
Bvlgari Omnia Crystalline Eau De Toilette For Women,https://www.perfume24x7.com//collections/women/products/bvlgari-omnia-crystalline-edt-for-women-65ml
Calvin Klein CK Euphoria Eau De Parfum For Women 100ml,https://www.perfume24x7.com//collections/women/products/euphoria-edp-by-calvin-klein
Versace Crystal Noir Eau de Parfum For Women 90ML,https://www.perfume24x7.com//collections/women/products/versace-crystal-noir-eau-de-parfum-for-women-90ml
Britney Spears Curious Eau De Parfum For Women 100ml,https://www.perfume24x7.com//collections/women/products/britney-spears-curious-for-women
Estee Lauder Modern Muse Nuit Eau De Parfum For Women,https://www.perfume24x7.com//collections/women/products/estee-lauder-modern-muse-nuit-edp-for-women-100ml
Kenzo Flower Eau de Parfum For Women,https://www.perfume24x7.com//collections/women/products/kenzo-flower-for-women
Paco Rabanne Ultra Violet Eau De Parfum For Women 80ml,https://www.perfume24x7.com//collections/women/products/paco-rabanne-ultra-violet-for-women
Chopard Malaki Oud Eau De Parfum 80ml,https://www.perfume24x7.com//collections/women/products/chopard-malaki-oud-eau-de-parfum-80ml
Twilly D'Hermes Deodorant For Women 150ml,https://www.perfume24x7.com//collections/women/products/twily-dhermes-deodorant-for-women-150ml
Elizabeth Arden Red Door Eau De Toilette For Women 100ml,https://www.perfume24x7.com//collections/women/products/elizabeth-arden-red-door-edp
Escada Magnetism Eau De Parfum For Women 75ML,https://www.perfume24x7.com//collections/women/products/escada-magnetism-edp-for-women-75ml
Calvin Klein CK Sheer Beauty Eau De Toilette For Women 100ml,https://www.perfume24x7.com//collections/women/products/ck-sheerbeauty-women-edt
Narsico Rodriguez Poudree Eau De Parfum For Women 90ml,https://www.perfume24x7.com//collections/women/products/narsico-rodriguez-poudree-edp-for-women-90ml
Cacharel Amor Amor Eau De Parfum For Women 100ML,https://www.perfume24x7.com//collections/women/products/cacharel-amor-amor-for-women
Mon Guerlain Eau De Parfum For Women 100ML,https://www.perfume24x7.com//collections/women/products/mon-guerlain-edp-for-women-100ml
Elizabeth Arden Provocative Women Eau De Parfum 100ml,https://www.perfume24x7.com//collections/women/products/elizabeth-arden-provocative-eau-de-parfum-for-women-100ml
Calvin Klein Contradiction Eau De Parfum For Women 100ml,https://www.perfume24x7.com//collections/women/products/calvin-klein-contradiction-edp-for-women-100ml-1
Elizabeth Arden Green Tea Eau De Toilette For Women 100ml,https://www.perfume24x7.com//collections/women/products/elizabeth-arden-green-tea-for-women
Paco Rabanne Lady Million Empire Eau De Parfum For Women 80ml,https://www.perfume24x7.com//collections/women/products/paco-rabanne-lady-empire-eau-de-parfum-for-women-80ml
Diesel Plus Plus Feminine Eau De Toilette 75ml,https://www.perfume24x7.com//collections/women/products/diesel-plus-plus-feminine-edt-75ml
Elizabeth Arden 5th Avenue Eau De Parfum For Women,https://www.perfume24x7.com//collections/women/products/elizabeth-arden-5th-avenue-for-women
Mugler Alien Eau De Parfum For Women,https://www.perfume24x7.com//collections/women/products/thierry-mugler-alien-eau-de-parfum-for-women-60-ml
Coach Eau De Parfum For Women 90ml,https://www.perfume24x7.com//collections/women/products/coach-new-york-edp-for-women-90ml
Calvin Klein CK One Shock Eau De Toilette For Her 200ml,https://www.perfume24x7.com//collections/women/products/calvin-klein-ck-one-shock-eau-de-toilette-for-her-200ml
Michael Kors Wonderlust Eau de Parfum 100ml,https://www.perfume24x7.com//collections/women/products/michael-kors-wonderlust-eau-de-parfum-100ml
Gucci Flora Gorgeous Gardenia Eau De Parfum 115ML Gift Set for Women,https://www.perfume24x7.com//collections/women/products/gucci-flora-gorgeous-gardenia-eau-de-parfum-115ml-gift-set-for-women
Calvin Klein Deep Euphoria Eau De Parfum For Women 100ml,https://www.perfume24x7.com//collections/women/products/calvin-klein-deep-euphoria-eau-de-parfum-for-women-100ml
Victoria's Secret Bombshell Seduction EDP,https://www.perfume24x7.com//collections/women/products/victorias-secret-bombshell-seduction-edp-100ml
Eternal Love Eau De Parfum For Women 100ml,https://www.perfume24x7.com//collections/women/products/eternal-love-for-women
Hugo Boss Deep Red Eau De Parfum For Women 90ml,https://www.perfume24x7.com//collections/women/products/hugo-boss-deep-red-for-women
Bvlgari Omnia Jewel Charms 3pc Miniature Spray Travel Collection 45ml,https://www.perfume24x7.com//collections/women/products/bvlgari-omnia-jewel-charms-3pc-miniature-spray-travel-collection-45ml
Versace Red Jeans Eau De Toilette For Women 75ml,https://www.perfume24x7.com//collections/women/products/versace-red-jeans-edt-for-women-75ml
Calvin Klein CK Eternity Moment Eau De Parfum 100ml For Women,https://www.perfume24x7.com//collections/women/products/ck-eternity-moment-women-edp
Elizabeth Arden Green Tea Lavender Eau De Toilette For Women 100ml,https://www.perfume24x7.com//collections/women/products/elizabeth-arden-green-tea-lavender-edt-for-women-100ml
Bvlgari Omnia Indian Garnet Miniature Spray Eau De Toilette For Women 15ML,https://www.perfume24x7.com//collections/women/products/bvlgari-omnia-indian-garnet-miniature-spray-eau-de-toilette-for-women-15ml
Guess Eau De Parfum For Women 75ml,https://www.perfume24x7.com//collections/women/products/guess-pink-for-women
Paco Rabanne Fame Eau De Parfum For Women 80ml,https://www.perfume24x7.com//collections/women/products/paco-rabanne-fame-eau-de-parfum-for-women-80ml
UCB Sisterland Pink Raspberry Eau De Toilette For Women 80ml,https://www.perfume24x7.com//collections/women/products/ucb-sisterland-pink-raspberry-edt-for-women-80ml
Jimmy Choo Eau De Toilette For Women 100 ML,https://www.perfume24x7.com//collections/women/products/jimmy-choo-edt-for-women-100-ml
Estee Lauder Beautiful Eau De Parfum For Women 75ml,https://www.perfume24x7.com//collections/women/products/estee-lauder-beautiful-edp-for-women-75ml
Titan Skinn Raw & Celeste Him & Her Gift Set,https://www.perfume24x7.com//collections/women/products/titan-skinn-raw-celeste-him-her-gift-set-50ml
Armaf Club De Nuit Sillage Eau De Parfum 105ml,https://www.perfume24x7.com//collections/women/products/armaf-club-de-nuit-sillage-edp-105ml
Chopard Musk Malaki Eau De Parfum 80ml,https://www.perfume24x7.com//collections/women/products/chopard-musk-malaki-eau-de-parfum-80ml
Calvin Klein CK Eternity Eau De Parfum  For Women 100ml,https://www.perfume24x7.com//collections/women/products/calvin-klein-eternity-edp-for-women-100ml
Ralph Lauren Romance Eau De Parfum For Women,https://www.perfume24x7.com//collections/women/products/ralph-lauren-romance-edp-for-women-100ml
Dolce & Gabbana Pour Femme Eau De Parfum For Women 100ML,https://www.perfume24x7.com//collections/women/products/dolce-gabbana-pour-femme-edp-for-women-100ml
Michael Kors Wonderlust Eau de Parfum 100ml,https://www.perfume24x7.com//collections/women/products/michael-kors-wonderlust-eau-de-parfum-100ml
Coach Eau De Parfum For Women 90ml,https://www.perfume24x7.com//collections/women/products/coach-new-york-edp-for-women-90ml
Calvin Klein CK One Shock Eau De Toilette For Her 200ml,https://www.perfume24x7.com//collections/women/products/calvin-klein-ck-one-shock-eau-de-toilette-for-her-200ml
Mugler Alien Eau De Parfum For Women,https://www.perfume24x7.com//collections/women/products/thierry-mugler-alien-eau-de-parfum-for-women-60-ml
Elizabeth Arden 5th Avenue Eau De Parfum For Women,https://www.perfume24x7.com//collections/women/products/elizabeth-arden-5th-avenue-for-women
Diesel Plus Plus Feminine Eau De Toilette 75ml,https://www.perfume24x7.com//collections/women/products/diesel-plus-plus-feminine-edt-75ml
Paco Rabanne Lady Million Empire Eau De Parfum For Women 80ml,https://www.perfume24x7.com//collections/women/products/paco-rabanne-lady-empire-eau-de-parfum-for-women-80ml
Elizabeth Arden Green Tea Eau De Toilette For Women 100ml,https://www.perfume24x7.com//collections/women/products/elizabeth-arden-green-tea-for-women
Calvin Klein Contradiction Eau De Parfum For Women 100ml,https://www.perfume24x7.com//collections/women/products/calvin-klein-contradiction-edp-for-women-100ml-1
Mon Guerlain Eau De Parfum For Women 100ML,https://www.perfume24x7.com//collections/women/products/mon-guerlain-edp-for-women-100ml
Elizabeth Arden Provocative Women Eau De Parfum 100ml,https://www.perfume24x7.com//collections/women/products/elizabeth-arden-provocative-eau-de-parfum-for-women-100ml
Elizabeth Arden Sunflowers Eau De Toilette For Women 100ml,https://www.perfume24x7.com//collections/women/products/elizabeth-arden-sunflower-for-women
Elizabeth Arden Green Tea Lavender Eau De Toilette For Women 100ml,https://www.perfume24x7.com//collections/women/products/elizabeth-arden-green-tea-lavender-edt-for-women-100ml
Calvin Klein CK Eternity Moment Eau De Parfum 100ml For Women,https://www.perfume24x7.com//collections/women/products/ck-eternity-moment-women-edp
Mont Blanc Individuelle Femme Eau De Toilette 75ml,https://www.perfume24x7.com//collections/women/products/mont-blanc-individuelle-femme-edt-75ml
Jimmy Choo Eau De Parfum For Women 100 ML,https://www.perfume24x7.com//collections/women/products/jimmy-choo-edp-for-women-100-ml
Titan Skinn Celeste Beyond Eau De Parfum For Women 100ml,https://www.perfume24x7.com//collections/women/products/titan-skinn-celeste-beyond-eau-de-parfum-for-women-100ml
Victoria's Secret Very Sexy Eau De Parfum RollerBall 7ml For Women,https://www.perfume24x7.com//collections/women/products/victorias-secret-very-sexy-edp-rollerball-7ml-for-women
Calvin Klein CK Obsession Eau De Parfum For Women 100ml,https://www.perfume24x7.com//collections/women/products/calvin-klein-obsession-edp-for-women-100ml
Viktor & Rolf FlowerBomb EDP For Women,https://www.perfume24x7.com//collections/women/products/viktor-rolf-flower-bomb-edp-for-women
Mont Blanc Signature Eau De Parfum For Women 90ML,https://www.perfume24x7.com//collections/women/products/mont-blanc-signature-eau-de-parfum-for-women-90ml
4711 Original Eau de Cologne By Echt Kolnisch Wasser For Men & Women,https://www.perfume24x7.com//collections/women/products/4711-original-eau-de-cologne-by-echt-kolnisch-wasser-for-men-women
Carolina Herrera 212 VIP Rose Women Eau De Parfum 80ml,https://www.perfume24x7.com//collections/women/products/carolina-herrera-212-vip-rose-women-edp-80ml
Gucci Rush Eau De Toilette for Women by Gucci 75ml,https://www.perfume24x7.com//collections/women/products/gucci-rush-edt-for-women-by-gucci-75ml
Elizabeth Arden 5th Avenue NYC Eau De Parfum For Women 125ml,https://www.perfume24x7.com//collections/women/products/elizabeth-arden-5th-avenue-nyc-edp-for-women-125ml
Birra Oud Sensation Eau De Parfum For Men & Women 50ml,https://www.perfume24x7.com//collections/women/products/birra-oud-sensation-eau-de-parfum-for-men-women-50ml
FCUK 3 Eau De Toilette For Women 100ml,https://www.perfume24x7.com//collections/women/products/fcuk-3-edt-for-women-100ml
Calvin Klein CK Eternity Air Eau De Parfum  For Women 100ml,https://www.perfume24x7.com//collections/women/products/calvin-klein-eternity-air-edp-for-women-100ml
Dolce & Gabbana The Only One Intense Eau De Parfum For Women 100ml,https://www.perfume24x7.com//collections/women/products/dolce-gabbana-the-only-one-intense-edp-for-women-100ml
Guess Seductive Noir Eau De Toilette For Women 75ml,https://www.perfume24x7.com//collections/women/products/guess-seductive-noir-eau-de-toilette-for-women-75ml
Salvatore Ferragamo Signorina Eau De Parfum For Women 100ml,https://www.perfume24x7.com//collections/women/products/salvatore-ferragamo-signorina-edp-for-women-100ml
Burberry Touch Eau De Parfum For Women 100ml,https://www.perfume24x7.com//collections/women/products/burberry-touch-edp-for-women-100ml
Ajmal Blu Eau De Parfum For Women 50ML,https://www.perfume24x7.com//collections/women/products/ajmal-blu-edp-for-women-50ml
Jimmy Choo Illicit Eau De Parfum For Women 100 ML,https://www.perfume24x7.com//collections/women/products/jimmy-choo-illicit-edp-for-women-100-ml
Paco Rabanne Pure XS For Women Eau De Parfum 80ml,https://www.perfume24x7.com//collections/women/products/paco-rabanne-pure-xs-for-women-edp-80ml
YSL Black Opium Floral Shock Eau De Parfum For Women 90ml,https://www.perfume24x7.com//collections/women/products/ysl-black-opium-floral-shock
Versace Red Jeans Eau De Toilette For Women 75ml,https://www.perfume24x7.com//collections/women/products/versace-red-jeans-edt-for-women-75ml
Elizabeth Arden Splendor Eau De Parfum For Women 125ml,https://www.perfume24x7.com//collections/women/products/elizabeth-arden-splendor-edp-for-women-125ml
Jennifer Lopez Glow For Women Eau De Toilette 100ml,https://www.perfume24x7.com//collections/women/products/j-lo-glow-women-edp
Giorgio Armani Acqua Di Gioia Eau De Parfum For Women,https://www.perfume24x7.com//collections/women/products/acqua-di-gioia-women-edp
Amalfi Bleu by Skinn for Women Eau De Parfum,https://www.perfume24x7.com//collections/women/products/amalfi-bleu-by-skinn-for-women-90-ml
Dolce & Gabbana Light Blue Eau De Toilette For Women 100ML,https://www.perfume24x7.com//collections/women/products/dolce-gabbana-light-blue-edt-for-women-100
Eternal Love Eau De Parfum For Women 100ml,https://www.perfume24x7.com//collections/women/products/eternal-love-for-women
Victoria's Secret Bombshell Seduction EDP,https://www.perfume24x7.com//collections/women/products/victorias-secret-bombshell-seduction-edp-100ml
Hugo Boss Deep Red Eau De Parfum For Women 90ml,https://www.perfume24x7.com//collections/women/products/hugo-boss-deep-red-for-women
Bvlgari Omnia Jewel Charms 3pc Miniature Spray Travel Collection 45ml,https://www.perfume24x7.com//collections/women/products/bvlgari-omnia-jewel-charms-3pc-miniature-spray-travel-collection-45ml
Gucci Flora Gorgeous Gardenia Eau De Parfum 115ML Gift Set for Women,https://www.perfume24x7.com//collections/women/products/gucci-flora-gorgeous-gardenia-eau-de-parfum-115ml-gift-set-for-women
Cacharel Amor Amor Eau De Parfum For Women 100ML,https://www.perfume24x7.com//collections/women/products/cacharel-amor-amor-for-women
Elizabeth Arden Red Door Eau De Toilette For Women 100ml,https://www.perfume24x7.com//collections/women/products/elizabeth-arden-red-door-edp
Twilly D'Hermes Deodorant For Women 150ml,https://www.perfume24x7.com//collections/women/products/twily-dhermes-deodorant-for-women-150ml
Narsico Rodriguez Poudree Eau De Parfum For Women 90ml,https://www.perfume24x7.com//collections/women/products/narsico-rodriguez-poudree-edp-for-women-90ml
Calvin Klein CK Sheer Beauty Eau De Toilette For Women 100ml,https://www.perfume24x7.com//collections/women/products/ck-sheerbeauty-women-edt
Escada Magnetism Eau De Parfum For Women 75ML,https://www.perfume24x7.com//collections/women/products/escada-magnetism-edp-for-women-75ml
Calvin Klein Deep Euphoria Eau De Parfum For Women 100ml,https://www.perfume24x7.com//collections/women/products/calvin-klein-deep-euphoria-eau-de-parfum-for-women-100ml
Chopard Malaki Oud Eau De Parfum 80ml,https://www.perfume24x7.com//collections/women/products/chopard-malaki-oud-eau-de-parfum-80ml
Paco Rabanne Ultra Violet Eau De Parfum For Women 80ml,https://www.perfume24x7.com//collections/women/products/paco-rabanne-ultra-violet-for-women
Calvin Klein CK Obsession Eau De Parfum For Women 100ml,https://www.perfume24x7.com//collections/women/products/calvin-klein-obsession-edp-for-women-100ml
Jimmy Choo Eau De Parfum For Women 100 ML,https://www.perfume24x7.com//collections/women/products/jimmy-choo-edp-for-women-100-ml
Paco Rabanne Pure XS For Women Eau De Parfum 80ml,https://www.perfume24x7.com//collections/women/products/paco-rabanne-pure-xs-for-women-edp-80ml
Mont Blanc Signature Eau De Parfum For Women 90ML,https://www.perfume24x7.com//collections/women/products/mont-blanc-signature-eau-de-parfum-for-women-90ml
Victoria's Secret Very Sexy Eau De Parfum RollerBall 7ml For Women,https://www.perfume24x7.com//collections/women/products/victorias-secret-very-sexy-edp-rollerball-7ml-for-women
Titan Skinn Celeste Beyond Eau De Parfum For Women 100ml,https://www.perfume24x7.com//collections/women/products/titan-skinn-celeste-beyond-eau-de-parfum-for-women-100ml
Viktor & Rolf FlowerBomb EDP For Women,https://www.perfume24x7.com//collections/women/products/viktor-rolf-flower-bomb-edp-for-women
4711 Original Eau de Cologne By Echt Kolnisch Wasser For Men & Women,https://www.perfume24x7.com//collections/women/products/4711-original-eau-de-cologne-by-echt-kolnisch-wasser-for-men-women
Dior J'adore Eau De Parfum For Women 100ml,https://www.perfume24x7.com//collections/women/products/christian-dior-jadore-for-women
Versace Eros Pour Femme Eau De Parfum For Women,https://www.perfume24x7.com//collections/women/products/versace-eros-pour-femme-edp-100ml-for-women
Calvin Klein CK IN2U Eau De Toilette For Women,https://www.perfume24x7.com//collections/women/products/calvin-klein-in2u-for-women
Bvlgari Omnia Amethyst Eau De Toilette For Women,https://www.perfume24x7.com//collections/women/products/bvlgari-omnia-ameythyst-edt-for-women-65ml
Versace Bright Crystal Eau De Toilette For Women,https://www.perfume24x7.com//collections/women/products/versace-bright-crystal-for-women
Gucci Guilty Eau de Toilette For Women,https://www.perfume24x7.com//collections/women/products/gucci-guilty-women-edt
Jennifer Lopez Still Eau De Parfum For Women 100ml,https://www.perfume24x7.com//collections/women/products/jennifer-lopez-still-edp
Estee Lauder White Linen Eau De Parfum For Women 60ml,https://www.perfume24x7.com//collections/women/products/estee-lauder-white-linen-edp-for-women-60ml
Victoria's Secret Deluxe 4pc Eau De Parfum Miniature Spray Gift Set 30ML,https://www.perfume24x7.com//collections/women/products/victorias-secret-deluxe-eau-de-parfum-miniature-spray-gift-set-7-5ml
Bvlgari Omnia Pink Sapphire Eau De Toilette For Women 65ml,https://www.perfume24x7.com//collections/women/products/bvlgari-omnia-pink-sapphire-edt-for-women-65ml
Carolina Herrera 212 Sexy Deodorant For Women 250ml,https://www.perfume24x7.com//collections/women/products/carolina-herrera-212-sexy-deodorant-for-women-150ml
Tom Ford Grey Vetiver Eau De Parfum 100ml,https://www.perfume24x7.com//collections/women/products/tom-ford-grey-vetiver-edp-100ml
Prada Candy Eau De Parfum For Women,https://www.perfume24x7.com//collections/women/products/prada-candy-edp-for-women
Rasasi Hawas Eau De Parfum For Women 100ml,https://www.perfume24x7.com//collections/women/products/rasasi-hawas-edp-for-women-100ml
YSL Manifesto Eau De Parfum For Women 90ML,https://www.perfume24x7.com//collections/women/products/ysl-manifesto-edp-50ml
Issey Miyake L'Eau d'Issey Pure Nectar Eau De Parfum 90 ML For Women,https://www.perfume24x7.com//collections/women/products/issey-miyake-leau-dissey-pure-nector-edp-90-ml-for-women
Burberry Brit Eau De Toilette For Women 100ml,https://www.perfume24x7.com//collections/women/products/burberry-brit-edt-for-women-100ml
Calvin Klein CK Truth Eau De Parfum For Women 100ml,https://www.perfume24x7.com//collections/women/products/calvin-klein-truth-eau-de-parfum-100ml
Cartier La Panthere Eau De Parfum For Women 75ml,https://www.perfume24x7.com//collections/women/products/cartier-la-panthere-edp-for-men-75ml
Guess Seductive Eau De Toilette For Women,https://www.perfume24x7.com//collections/women/products/guess-seductive-for-women
Burberry Goddess Eau De Parfum For Women 100ml,https://www.perfume24x7.com//collections/women/products/burberry-goddess-eau-de-parfum-for-women-100ml
Burberry London Eau De Parfum For Women 100ml,https://www.perfume24x7.com//collections/women/products/burberry-london-for-women
Chanel Chance Eau Tender Eau De Parfum For Women 100ml,https://www.perfume24x7.com//collections/women/products/chanel-chance-eau-tender-eau-de-parfum-for-women-100ml
Amalfi Bleu by Skinn for Women Eau De Parfum,https://www.perfume24x7.com//collections/women/products/amalfi-bleu-by-skinn-for-women-90-ml
