perfume_name,perfume_link
Issey Miyake L'eau D'Issey Pure Petale De Nector Eau De Toilette 90 ML For Women,https://www.perfume24x7.com//collections/women/products/issey-miyake-leau-dissey-pure-petale-de-nector-edp-90-ml-for-women
Victoria's Secret Bombshell Summer Eau De Parfum For Women,https://www.perfume24x7.com//collections/women/products/victorias-secret-bombshell-summer-edp-for-women-100ml-1
Versace Crystal Noir Eau De Toilette For Women 90ml,https://www.perfume24x7.com//collections/women/products/versace-crystal-noir-edt-for-women-90ml
Issey Miyake L'Eau d'Issey Pure Eau De Parfum 90 ML For Women,https://www.perfume24x7.com//collections/women/products/issey-miyake-pure-edp-90-ml-for-women
Elizabeth Arden True Love Eau De Toilette For Women 100ml,https://www.perfume24x7.com//collections/women/products/elizabeth-arden-true-love-edt-for-women-100ml
Calvin Klein CK Eternity Flame Eau De Parfum For Women 100ML,https://www.perfume24x7.com//collections/women/products/calvin-klein-ck-eternity-flame-eau-de-parfum-for-women-100ml
Victoria's Secret Very Sexy Sea Eau De Parfum RollerBall 7ml For Women,https://www.perfume24x7.com//collections/women/products/victorias-secret-very-sexy-sea-edp-rollerball-7ml-for-women
Victoria's Secret Bombshell Intense EDP For Women,https://www.perfume24x7.com//collections/women/products/victorias-secret-bombshell-intense-edp-for-women
Hugo Boss The Scent Private Accord Eau De Parfum For Women,https://www.perfume24x7.com//collections/women/products/hugo-boss-the-scent-private-accord-edp-for-women-100ml
Bvlgari Omnia 5pc Miniature Travel Collection 25ml,https://www.perfume24x7.com//collections/women/products/bvlgari-omnia-3pc-mini-travel-collection-5ml-each
Calvin Klein Obsession Night Eau De Parfum For Women 100ml,https://www.perfume24x7.com//collections/women/products/calvin-klein-obsession-night-eau-de-parfum-for-women-100ml
Paco Rabanne Olympea Eau De Parfum For Women 80ml,https://www.perfume24x7.com//collections/women/products/paco-rabanne-olympea-eau-de-parfum-for-women-80ml
United Colors of Benetton United Dreams Stay Positive Eau De Toilette For Women 80ml,https://www.perfume24x7.com//collections/women/products/united-colors-of-benetton-united-dreams-stay-positive-edt-for-women-100ml
Abercrombie Fitch Fierce For Women Eau de Parfum 50ml,https://www.perfume24x7.com//collections/women/products/abercrombie-fitch-fierce-mens-eau-de-parfum-50ml
Issey Miyake Leau Dissey For Women 100ml Eau De Toilette,https://www.perfume24x7.com//collections/women/products/issey-miyake-leau-dissey-for-women
Versace Bright Crystal Absolu Eau De Parfum 90ml For Women,https://www.perfume24x7.com//collections/women/products/versace-bright-crystal-absolute-edp-90ml-for-women
Narciso Rodriguez Fleur Musc Eau De Parfum For Women,https://www.perfume24x7.com//collections/women/products/narciso-rodriguez-fleur-musc-edp-for-women
Bvlgari Jasmin Noir Eau De Parfum For Women 100ml,https://www.perfume24x7.com//collections/women/products/bvlgari-jasmin-noir-edp-for-women-100ml
Victoria's Secret Pure Seduction Refreshing Gel Body Wash for Women 300ml,https://www.perfume24x7.com//collections/women/products/victorias-secret-pure-seduction-refreshing-gel-body-wash-for-women-300ml
Elizabeth Taylor Forever Elizabeth Eau De Parfum For Women 100ml,https://www.perfume24x7.com//collections/women/products/elizabeth-arden-forever-elizabeth-eau-de-parfum-for-women-100ml
Elizabeth Taylor White Diamonds EDT For Women 100ml,https://www.perfume24x7.com//collections/women/products/elizabeth-taylor-white-diamonds-for-women
Rasasi Dareez Pour Femme Eau De Parfum For Women 100ml,https://www.perfume24x7.com//collections/women/products/rasasi-dareez-pour-femme-edp-for-women-100ml
Boss Intense Eau De Parfum For Women,https://www.perfume24x7.com//collections/women/products/boss-intense-for-women
Lancome La Vie Est Belle Eau De Parfum For Woman,https://www.perfume24x7.com//collections/women/products/lancome-is-vie-est-belle-edp
Gucci Bamboo Eau De Parfum For Women 75ml,https://www.perfume24x7.com//collections/women/products/gucci-bamboo-eau-de-parfum-for-women-75ml
United Colors of Benetton Sports Eau De Toilette  For Women 100ml,https://www.perfume24x7.com//collections/women/products/benetton-sports-for-women
Jovan Black Musk Cologne For Women 96ml,https://www.perfume24x7.com//collections/women/products/jovan-black-musk-cologne-for-women-96ml
Calvin Klein CK Eternity Summer Eau De Parfum For Women 100ml,https://www.perfume24x7.com//collections/women/products/calvin-klein-ck-eternity-summer-eau-de-parfum-for-women-100ml
Birra Affluence Eau De Parfum For Men & Women 100ml,https://www.perfume24x7.com//collections/women/products/birra-affluence-eau-de-parfum-for-men-women-100ml
Calvin Klein CK Miniature Travel Collection For Women 4pc Spray 15ml each,https://www.perfume24x7.com//collections/women/products/calvin-klein-miniature-deluxe-travel-collection-for-women-4pc-spray-15ml-each
Victoria's Secret Love Spell Cloud Wash Foaming Gel Cleanser for Women 130gm,https://www.perfume24x7.com//collections/women/products/victorias-secret-love-spell-cloud-wash-foaming-gel-cleanser-for-women-130gm
Victoria's Secret Very Sexy Orchid Eau De Parfum RollerBall 7ml For Women,https://www.perfume24x7.com//collections/women/products/victorias-secret-very-sexy-orchid-edp-rollerball-7ml-for-women
Clinique Happy Parfum Spray For Women 100ML,https://www.perfume24x7.com//collections/women/products/clinique-happy-parfum-spray-for-women-100ml
Victoria's Secret Love Spell Refreshing Gel Body Wash for Women 300ml,https://www.perfume24x7.com//collections/women/products/victorias-secret-love-spell-refreshing-gel-body-wash-for-women-300ml
United Colors of Benetton Colors Woman Rose Eau De Toilette 80ml,https://www.perfume24x7.com//collections/women/products/united-colors-of-benetton-colors-woman-rose-eau-de-toilette-for-women-80ml
Reno By Ralph Lauren Eau De Toilette For Women 100ML,https://www.perfume24x7.com//collections/women/products/ralph-lauren-reno-eau-de-toilette-for-men-100ml
Ramz Lattafa Eau De Parfum Natural Spray 100ML,https://www.perfume24x7.com//collections/women/products/rama-lattafa-eau-de-parfum-natural-spray-for-men-100ml
Victoria's Secret Velvet Petals Cloud Wash Foaming Gel Cleanser for Women 130gm,https://www.perfume24x7.com//collections/women/products/victorias-secret-velvet-petals-cloud-wash-foaming-gel-cleanser-for-women
Titan Skinn Sheer Eau De Parfum For Women,https://www.perfume24x7.com//collections/women/products/titan-sheer-women
Ted Lapidus Rumba EDT For Women 100ml,https://www.perfume24x7.com//collections/women/products/ted-lapidus-rumba-edt-for-women-100ml
Elizabeth Arden Green Tea Jasmine Eau De Toilette For Women 100ml,https://www.perfume24x7.com//collections/women/products/elizabeth-arden-green-tea-jasmine-edt-for-women-100ml
Jennifer Lopez Still Eau De Parfum Gift Set For Women 100ml,https://www.perfume24x7.com//collections/women/products/jennifer-lopez-still-eau-de-parfum-gift-set-for-women-100ml
Giorgio Armani Si Eau De Parfum For Women,https://www.perfume24x7.com//collections/women/products/si-edp-women
Burberry My Burberry Black Eau De Parfum  For Women 90ml,https://www.perfume24x7.com//collections/women/products/burberry-my-burberry-black-edp-for-women-90-ml
Hugo Woman Eau De Parfum 75ml By Hugo Boss,https://www.perfume24x7.com//collections/women/products/hugo-woman-edp-75ml-by-hugo-boss
Burberry Her Deodorant For Women 100 ML,https://www.perfume24x7.com//collections/women/products/burberry-her-deodorant-for-women-150-ml
Mademoiselle Ricci By Nina Ricci Eau De Parfum For Women 80ml,https://www.perfume24x7.com//collections/women/products/mademoiselle-ricci-by-nina-ricci-edp-for-women-80ml
United Colors of Benetton United Dreams Love Yourself Eau De Toilette 80ml Gift Set  For Women,https://www.perfume24x7.com//collections/women/products/united-colors-of-benetton-united-dreams-love-yourself-eau-de-toilette-for-women
Carrera Speed Pour Femme Eau De Parfum For Women 100ML,https://www.perfume24x7.com//collections/women/products/carrera-speed-women-edp
Police To Be Eau de Parfum For Women 125ml,https://www.perfume24x7.com//collections/women/products/police-to-be-for-women-eau-de-parfum-125ml
Victoria's Secret Heavenly Eau De Parfum RollerBall 7ml For Women,https://www.perfume24x7.com//collections/women/products/victorias-secret-heavenly-edp-rollerball-7ml-for-women
Davidoff Coolwater Night dive For Women 80ml,https://www.perfume24x7.com//collections/women/products/davidoff-coolwater-nightdive-for-women
United Colors of Benetton United Dreams Together Eau De Toilette Gift Set For Women 80ml,https://www.perfume24x7.com//collections/women/products/united-colors-of-benetton-united-dreams-together-eau-de-toilette-gift-set-for-women-80ml
Burberry Body Intense Eau De Parfum For Women 85ml,https://www.perfume24x7.com//collections/women/products/burberry-body-intense-edp-for-women-85ml
Victoria's Secret Love EDP For Women 100ml,https://www.perfume24x7.com//collections/women/products/victorias-secret-love-edp-for-women-100ml
Carolina Herrera Good Girl Eau De Parfum Supreme Women 80ml,https://www.perfume24x7.com//collections/women/products/carolina-herrera-good-girl-supreme-eau-de-parfum-women-80ml
Momento Lace Eau De Parfum 100ml By Armaf LUXE,https://www.perfume24x7.com//collections/women/products/momento-lace-edp-100ml-by-armaf-luxe
Momento Fleur Eau De Parfum 100ml By Armaf LUXE,https://www.perfume24x7.com//collections/women/products/momento-fleur-edp-100ml-by-armaf-luxe
Hypnotic Poison By Dior Eau De Toilette For Women 100ml,https://www.perfume24x7.com//collections/women/products/hypnotic-poison-by-dior-edt-for-women-100ml
Guess Girl Belle Eau De Toilette For Women For 100ml,https://www.perfume24x7.com//collections/women/products/guess-girl-belle-edt-for-women-for-100ml
Calvin Klein CK2 Eau De Toilette For Men & Women 100ml,https://www.perfume24x7.com//collections/women/products/calvin-klein-ck2-eau-de-toilette-for-men-women-100ml
Burberry The Beat Eau De Parfum For Women 75ml,https://www.perfume24x7.com//collections/women/products/burberry-the-beat-for-women
Dolce & Gabbana Dolce Garden Eau De Parfum For Women 75ML,https://www.perfume24x7.com//collections/women/products/dolce-gabbana-dolce-garden-edp-for-women-75ml
United Colors of Benetton Colors Woman Rose Eau De Toilette Gift Set For Women 80ml,https://www.perfume24x7.com//collections/women/products/united-colors-of-benetton-colors-woman-rose-eau-de-toilette-gift-set-for-women-80ml
Antonio Banderas Her Secret Eau De Toilette 80 ML,https://www.perfume24x7.com//collections/women/products/antonio-banderas-her-secret-edt-80-ml
Woman By Ralph Lauren Eau De Parfum 100ml,https://www.perfume24x7.com//collections/women/products/woman-by-ralph-lauren-edp-100ml
Calvin Klein CK One Gold Eau De Toilette,https://www.perfume24x7.com//collections/women/products/calvin-klein-one-gold-edt-200ml
United Colors of Benetton United Dream Big Eau De Toilette For Women 80ml,https://www.perfume24x7.com//collections/women/products/united-colors-of-benetton-united-dream-big-edt-for-women-80ml
Lacoste Love of Pink Eau De Toilette For Women 90ml,https://www.perfume24x7.com//collections/women/products/lacoste-love-of-pink-eau-de-toilette-for-women-90ml
Guess 1981 Indigo Eau de Toilette For Women 100ml,https://www.perfume24x7.com//collections/women/products/guess-1981-indigo-eau-de-toilette-for-women-100ml
Victoria's Secret Tease Dreamer EDP For Women 50ml,https://www.perfume24x7.com//collections/women/products/victorias-secret-tease-dreamer-edp-for-women-50ml
Arden Beauty Eau De Parfum By Elizabeth Arden For Women 100ML,https://www.perfume24x7.com//collections/women/products/elizabeth-arden-arden-beauty-edp
United Colors of Benetton United Dreams Together Eau De Toilette For Women 80ml,https://www.perfume24x7.com//collections/women/products/united-colors-of-benetton-united-dreams-together-edt-for-women-80ml
Britney Spears Fantasy Eau De Parfum for Women 100ml,https://www.perfume24x7.com//collections/women/products/britney-spears-fantasy-edp-for-women-100ml
Versace Bright Crystal Perfumed Deodorant for Women 50ml,https://www.perfume24x7.com//collections/women/products/versace-bright-crystal-perfumed-deodorant-for-women-50ml
Mont Blanc Lady Emblem Elixir 75 Ml Eau De Parfum For Women,https://www.perfume24x7.com//collections/women/products/mont-blanc-lady-emblem-elixir-75-ml-edp-for-women
Paco Rabanne Lady Million Eau De Parfum For Women 80ml,https://www.perfume24x7.com//collections/women/products/paco-rabanne-lady-million-edp-80ml-for-women
Victoria's Secret Bombshell Paris Eau De Parfum For Women 100ml,https://www.perfume24x7.com//collections/women/products/victorias-secret-bombshell-paris-edp-for-women-100ml
Azzaro Wanted Girl Eau De Parfum For Women,https://www.perfume24x7.com//collections/women/products/azzaro-wanted-girl-eau-de-parfum-for-women
Luna Blossom By Nina Ricci Eau De Toilette For Women 80ml,https://www.perfume24x7.com//collections/women/products/luna-blossom-by-nina-ricci-edt-for-women-80ml
Issey Miyake A Drop D'Issey Eau De Parfum For Women 90ML,https://www.perfume24x7.com//collections/women/products/cissey-miyake-a-drop-dissey-eau-de-parfum-for-women-90ml
Gucci Intense Oud Eau De Parfum For Men & Women 90ML,https://www.perfume24x7.com//collections/women/products/gucci-intense-oud-eau-de-parfum-for-men-women-90ml
Versace Pour Femme Dylan Turquoise Eau De Toilette For Women 100ML,https://www.perfume24x7.com//collections/women/products/versace-pour-femme-dylan-turquoise-eau-de-toilette-100ml-for-women
Versace Eros Pour Femme Eau De Parfum For Women,https://www.perfume24x7.com//collections/women/products/versace-eros-pour-femme-edp-100ml-for-women
Calvin Klein CK IN2U Eau De Toilette For Women,https://www.perfume24x7.com//collections/women/products/calvin-klein-in2u-for-women
Calvin Klein CK Sheer Beauty Essence Eau De Toilette For Women 100ml,https://www.perfume24x7.com//collections/women/products/calvin-klein-sheer-beauty-essence-edt-for-women-100ml
Paco Rabanne Black XS For Women Eau De Parfum 80ml,https://www.perfume24x7.com//collections/women/products/paco-rabanne-black-xs-for-women-edp-80ml
Burberry Her Deodorant For Women 100 ML,https://www.perfume24x7.com//collections/women/products/burberry-her-deodorant-for-women-150-ml
Hugo Woman Eau De Parfum 75ml By Hugo Boss,https://www.perfume24x7.com//collections/women/products/hugo-woman-edp-75ml-by-hugo-boss
Burberry My Burberry Black Eau De Parfum  For Women 90ml,https://www.perfume24x7.com//collections/women/products/burberry-my-burberry-black-edp-for-women-90-ml
Jennifer Lopez Still Eau De Parfum Gift Set For Women 100ml,https://www.perfume24x7.com//collections/women/products/jennifer-lopez-still-eau-de-parfum-gift-set-for-women-100ml
Ted Lapidus Rumba EDT For Women 100ml,https://www.perfume24x7.com//collections/women/products/ted-lapidus-rumba-edt-for-women-100ml
Titan Skinn Sheer Eau De Parfum For Women,https://www.perfume24x7.com//collections/women/products/titan-sheer-women
Victoria's Secret Love Spell Cloud Wash Foaming Gel Cleanser for Women 130gm,https://www.perfume24x7.com//collections/women/products/victorias-secret-love-spell-cloud-wash-foaming-gel-cleanser-for-women-130gm
Giorgio Armani Si Eau De Parfum For Women,https://www.perfume24x7.com//collections/women/products/si-edp-women
Elizabeth Arden Green Tea Jasmine Eau De Toilette For Women 100ml,https://www.perfume24x7.com//collections/women/products/elizabeth-arden-green-tea-jasmine-edt-for-women-100ml
United Colors of Benetton United Dreams Together Eau De Toilette Gift Set For Women 80ml,https://www.perfume24x7.com//collections/women/products/united-colors-of-benetton-united-dreams-together-eau-de-toilette-gift-set-for-women-80ml
Calvin Klein CK One In Red Limited Edition Eau De Toilette 100ml,https://www.perfume24x7.com//collections/women/products/calvin-klein-one-in-red-limited-edition-edt-for-her-100ml
United Colors of Benetton Colors Woman Rose Eau De Toilette Gift Set For Women 80ml,https://www.perfume24x7.com//collections/women/products/united-colors-of-benetton-colors-woman-rose-eau-de-toilette-gift-set-for-women-80ml
Antonio Banderas Her Secret Eau De Toilette 80 ML,https://www.perfume24x7.com//collections/women/products/antonio-banderas-her-secret-edt-80-ml
Dolce & Gabbana Dolce Garden Eau De Parfum For Women 75ML,https://www.perfume24x7.com//collections/women/products/dolce-gabbana-dolce-garden-edp-for-women-75ml
Burberry The Beat Eau De Parfum For Women 75ml,https://www.perfume24x7.com//collections/women/products/burberry-the-beat-for-women
Hypnotic Poison By Dior Eau De Toilette For Women 100ml,https://www.perfume24x7.com//collections/women/products/hypnotic-poison-by-dior-edt-for-women-100ml
Calvin Klein CK2 Eau De Toilette For Men & Women 100ml,https://www.perfume24x7.com//collections/women/products/calvin-klein-ck2-eau-de-toilette-for-men-women-100ml
Guess Girl Belle Eau De Toilette For Women For 100ml,https://www.perfume24x7.com//collections/women/products/guess-girl-belle-edt-for-women-for-100ml
Mont Blanc Lady Emblem Eau De Parfum 75 Ml For Women,https://www.perfume24x7.com//collections/women/products/mont-blanc-lady-emblem-edp-75-ml-for-women
Calvin Klein CK Eternity Intense Eau De Parfum For Women 100ml,https://www.perfume24x7.com//collections/women/products/calvin-klein-eternity-intense-edp-for-women-100ml
Luna By Nina Ricci Eau De Toilette For Women 80ml,https://www.perfume24x7.com//collections/women/products/luna-by-nina-ricci-edt-for-women-80ml
Mercedes Benz Woman Eau De Parfum 2pc Gift Set,https://www.perfume24x7.com//collections/women/products/mercedes-benz-woman-eau-de-parfum-2pc-gift-set
Skinn Noura Iris Eau De Parfum For Her 100ML,https://www.perfume24x7.com//collections/women/products/skinn-noura-iris-eau-de-parfum-for-her-100ml
Givenchy Hot Couture Eau De Parfum For Women 100 ML,https://www.perfume24x7.com//collections/women/products/givenchy-hot-couture-edp-100-ml-for-women
Antonio Banderas Golden Secret For Women Eau De Toilette 80ml,https://www.perfume24x7.com//collections/women/products/antonio-banderas-golden-secret-for-women-edt-80ml
Narciso Rodriguez Eau De Parfum For Her,https://www.perfume24x7.com//collections/women/products/narciso-rodriguez-edp-for-her-100ml
Poison By Dior Eau De Toilette For Women 100ml,https://www.perfume24x7.com//collections/women/products/christian-dior-poison-edt
Victoria's Secret Tease Eau De Parfum RollerBall 7ml For Women,https://www.perfume24x7.com//collections/women/products/victorias-secret-tease-edp-rollerball-7ml-for-women
Police Passion For Women Eau De Toilette 100ml,https://www.perfume24x7.com//collections/women/products/police-passion-for-women-edt-100ml
Burberry My Burberry Blush Eau De Parfum For Women 90ml,https://www.perfume24x7.com//collections/women/products/burberry-my-burberry-blush-edp-for-women-90-ml
Nina Ricci L'Air Du Temps Eau De Toilette For Women 100ml,https://www.perfume24x7.com//collections/women/products/nina-ricci-lair-du-temps-edt-for-women-100ml
HUGO BOSS Woman Eau De Toilette 125ML,https://www.perfume24x7.com//collections/women/products/hugo-boss-woman-eau-de-toilette-125ml
Antonio Banderas Queen of Seduction For Women Eau De Toilette 80 ML,https://www.perfume24x7.com//collections/women/products/antonio-banderas-queen-of-seduction-for-women-edt-80-ml
YSL Mon Paris Eau De Parfum For Women 90ml,https://www.perfume24x7.com//collections/women/products/ysl-mon-paris-90ml-edp-for-women
UCB Sisterland Red Rose Eau De Toilette For Women 80ml,https://www.perfume24x7.com//collections/women/products/ucb-sisterland-red-rose-edt-for-women-80ml
UCB Sisterland Green Jasmine Eau De Toilette  For Women 80ml,https://www.perfume24x7.com//collections/women/products/ucb-sisterland-green-jasmine-edt-for-women-80ml
Calvin Klein CK DownTown Eau De Parfum For Women 90ml,https://www.perfume24x7.com//collections/women/products/calvin-klein-downtown-edp-for-women-90ml
Lancome Miracle Eau De Parfum For Women 100ml,https://www.perfume24x7.com//collections/women/products/lancome-miracle-edp-for-women-100ml
Elie Saab Girl of Now Deodorant for Woman 100ml,https://www.perfume24x7.com//collections/women/products/elie-saab-girl-of-now-deodorant-for-woman-150ml
Britney Spears Private Show Eau De Parfum for Women 100ml,https://www.perfume24x7.com//collections/women/products/britney-spears-private-show-edp-for-women-100ml
Carolina Herrera Good Girl Fantastic Pink Eau De Parfum Women 80ml,https://www.perfume24x7.com//collections/women/products/carolina-herrera-good-girl-fantastic-pink-eau-de-parfum-women-80ml
Salvatore Ferragamo Incanto Dream Eau De Toilette For Women 100ml,https://www.perfume24x7.com//collections/women/products/salvador-ferragamo-incanto-dream-women-edt
Paco Rabanne Olympea Deodorant Natural Spray For Women 150ML,https://www.perfume24x7.com//collections/women/products/paco-rabanne-pure-xs-deodorant-for-women-150ml
Tom Ford Black Orchid Eau De Parfum 100ml,https://www.perfume24x7.com//collections/women/products/tom-ford-black-orchid-edp
Victoria's Secret Velvet Petals Refreshing Gel Body Wash for Women 300ml,https://www.perfume24x7.com//collections/women/products/victorias-secret-velvet-petals-refreshing-gel-body-wash-for-women-300ml
Momento Lace Eau De Parfum 100ml By Armaf LUXE,https://www.perfume24x7.com//collections/women/products/momento-lace-edp-100ml-by-armaf-luxe
Momento Fleur Eau De Parfum 100ml By Armaf LUXE,https://www.perfume24x7.com//collections/women/products/momento-fleur-edp-100ml-by-armaf-luxe
Davidoff Coolwater Night dive For Women 80ml,https://www.perfume24x7.com//collections/women/products/davidoff-coolwater-nightdive-for-women
Victoria's Secret Heavenly Eau De Parfum RollerBall 7ml For Women,https://www.perfume24x7.com//collections/women/products/victorias-secret-heavenly-edp-rollerball-7ml-for-women
Police To Be Eau de Parfum For Women 125ml,https://www.perfume24x7.com//collections/women/products/police-to-be-for-women-eau-de-parfum-125ml
Victoria's Secret Love EDP For Women 100ml,https://www.perfume24x7.com//collections/women/products/victorias-secret-love-edp-for-women-100ml
Burberry Body Intense Eau De Parfum For Women 85ml,https://www.perfume24x7.com//collections/women/products/burberry-body-intense-edp-for-women-85ml
Carolina Herrera Good Girl Eau De Parfum Supreme Women 80ml,https://www.perfume24x7.com//collections/women/products/carolina-herrera-good-girl-supreme-eau-de-parfum-women-80ml
Carrera Speed Pour Femme Eau De Parfum For Women 100ML,https://www.perfume24x7.com//collections/women/products/carrera-speed-women-edp
Mademoiselle Ricci By Nina Ricci Eau De Parfum For Women 80ml,https://www.perfume24x7.com//collections/women/products/mademoiselle-ricci-by-nina-ricci-edp-for-women-80ml
United Colors of Benetton United Dreams Love Yourself Eau De Toilette 80ml Gift Set  For Women,https://www.perfume24x7.com//collections/women/products/united-colors-of-benetton-united-dreams-love-yourself-eau-de-toilette-for-women
Givenchy Hot Couture Eau De Parfum For Women 100 ML,https://www.perfume24x7.com//collections/women/products/givenchy-hot-couture-edp-100-ml-for-women
Skinn Noura Iris Eau De Parfum For Her 100ML,https://www.perfume24x7.com//collections/women/products/skinn-noura-iris-eau-de-parfum-for-her-100ml
Mercedes Benz Woman Eau De Parfum 2pc Gift Set,https://www.perfume24x7.com//collections/women/products/mercedes-benz-woman-eau-de-parfum-2pc-gift-set
Calvin Klein CK One In Red Limited Edition Eau De Toilette 100ml,https://www.perfume24x7.com//collections/women/products/calvin-klein-one-in-red-limited-edition-edt-for-her-100ml
Mont Blanc Lady Emblem Eau De Parfum 75 Ml For Women,https://www.perfume24x7.com//collections/women/products/mont-blanc-lady-emblem-edp-75-ml-for-women
Luna By Nina Ricci Eau De Toilette For Women 80ml,https://www.perfume24x7.com//collections/women/products/luna-by-nina-ricci-edt-for-women-80ml
Calvin Klein CK Eternity Intense Eau De Parfum For Women 100ml,https://www.perfume24x7.com//collections/women/products/calvin-klein-eternity-intense-edp-for-women-100ml
Narciso Rodriguez Eau De Parfum For Her,https://www.perfume24x7.com//collections/women/products/narciso-rodriguez-edp-for-her-100ml
Poison By Dior Eau De Toilette For Women 100ml,https://www.perfume24x7.com//collections/women/products/christian-dior-poison-edt
Nina Ricci L'Air Du Temps Eau De Toilette For Women 100ml,https://www.perfume24x7.com//collections/women/products/nina-ricci-lair-du-temps-edt-for-women-100ml
Burberry My Burberry Blush Eau De Parfum For Women 90ml,https://www.perfume24x7.com//collections/women/products/burberry-my-burberry-blush-edp-for-women-90-ml
Police Passion For Women Eau De Toilette 100ml,https://www.perfume24x7.com//collections/women/products/police-passion-for-women-edt-100ml
Victoria's Secret Tease Eau De Parfum RollerBall 7ml For Women,https://www.perfume24x7.com//collections/women/products/victorias-secret-tease-edp-rollerball-7ml-for-women
Antonio Banderas Golden Secret For Women Eau De Toilette 80ml,https://www.perfume24x7.com//collections/women/products/antonio-banderas-golden-secret-for-women-edt-80ml
Nina Ricci Premier Jour Eau De Parfum For Women 100ml,https://www.perfume24x7.com//collections/women/products/nina-ricci-premier-jour-for-women
Versace Versus Eau De Toilette For Women 100ml,https://www.perfume24x7.com//collections/women/products/versace-versus-edt-for-women-100ml
Titan Skinn Amalfi Blue Him/Her Gift Set 90ml,https://www.perfume24x7.com//collections/women/products/titan-skinn-amalfi-blue-him-her-gift-set-90ml
Elie Saab 4pc Miniatures Collection Eau De Parfum For Women,https://www.perfume24x7.com//collections/women/products/elie-saab-4pc-miniatures-collection-eau-de-parfum-for-women
Skinn Noura Floret Eau De Parfum For Her 100ML,https://www.perfume24x7.com//collections/women/products/skinn-noura-floret-eau-de-parfum-for-her-100ml
